id,set,phase,question_type,topic,cognition_axis,format_axis,recency_axis,trickiness_axis,question,A,B,C,D,answer,explanation,wrong_A,wrong_B,wrong_C,wrong_D,trap_point,story_hint,search_keywords
G3000-R13-024,Rebuild_Set13,rebuild_50,case,外部委託管理,application,case,stable,vendor_risk,AIベンダーを選定する際の確認事項として最も適切なものはどれか。,営業資料が派手かどうかだけ,社名が短いかどうかだけ,デモ画面が未来的かどうかだけ,データ管理、セキュリティ、実績、説明可能性、保守体制、契約条件など,D,ベンダー選定では、機能だけでなくデータ保護、運用保守、説明、契約条件を確認する。,見た目だけでは判断できない。,社名の長さは無関係。,デモは参考だが実運用の保証ではない。,正しい。多面的に確認する。,ベンダー選定はデモの印象で決めない。,さいはての道具も、光っているから安全とは限らない。,AIベンダー;外部委託;セキュリティ;保守体制;契約条件
G3000-R13-025,Rebuild_Set13,rebuild_50,case,シャドーAI,application,case,recent,shadow_ai,社員が会社に無断で個人契約の生成AIを使い、業務資料を処理している。これを防ぐ対策として最も適切なものはどれか。,利用可能なAI、禁止情報、申請手順、監査方法を明確にし、代替となる安全な利用環境を用意する,全面禁止の掲示だけを出し、現場の業務課題は放置する,発覚しなければ問題ないとする,個人判断に任せ、ルールや教育は行わない,A,シャドーAI対策では、ルール、教育、利用可能な環境、監査を組み合わせることが重要である。,正しい。禁止だけでなく安全な選択肢を作る。,禁止だけでは隠れて使われる可能性がある。,情報漏えいリスクがある。,個人任せでは統制できない。,生成AIは便利だからこそ、禁止だけではなく安全な道を作る。,ユイにミチを使うなと言うだけでは足りない。安全な使い方が必要。,シャドーAI;生成AI利用ルール;社内AI;情報漏えい;AIガバナンス
G3000-R13-026,Rebuild_Set13,rebuild_50,term,AIレッドチーミング,understanding,term,recent,safety_definition,生成AIのレッドチーミングに関する説明として最も適切なものはどれか。,モデルの色を赤に変更して可視化する作業,悪用・脱獄・有害出力などを想定し、意図的に弱点を探して改善につなげる取り組み,学習率を固定して性能を比較する手法,データを赤・青・緑の3クラスに分類する前処理,B,レッドチーミングは、攻撃者視点でAIの弱点や危険な出力を洗い出し、安全対策に反映する取り組みである。,色変更ではない。,正しい。安全性検証の一種。,最適化手法ではない。,分類前処理ではない。,レッドチーミングは通常利用のテストだけでなく、悪用を想定する点が特徴。,さいはてで安全な道だけでなく、壊れそうな道もあえて調べる。,AIレッドチーミング;生成AI安全性;脱獄;有害出力;脆弱性検証
G3000-R13-027,Rebuild_Set13,rebuild_50,case,出力検証,application,case,recent,llm_validation,LLMが生成した契約書要約を業務で使う場合の対応として最も適切なものはどれか。,生成文は必ず正しいので原文確認は不要,自然な日本語なら法的意味も必ず正しい,原文との照合、重要条項の人間確認、出典・根拠確認を行う,要約が短ければリスクはない,C,LLM出力は自然でも誤りうるため、契約など重要文書では原文照合と人間確認が必要である。,LLMはハルシネーションや要約漏れを起こす。,流暢さは正確性を保証しない。,正しい。根拠確認と人間レビューが必要。,短い要約でも重要条項が落ちる可能性がある。,自然な文章ほど誤りに気づきにくい。,ユイが「ユイさんらしい文」と言われても、自分の判断で残すか決める。,LLM;契約書要約;出力検証;ハルシネーション;人間確認
G3000-R13-028,Rebuild_Set13,rebuild_50,case,AI教育,application,case,stable,literacy,企業で生成AI利用を始める際の従業員教育として最も適切なものはどれか。,プロンプト例だけ配り、リスクは説明しない,禁止事項だけ暗記させ、なぜ危険かは伝えない,AIは万能であると教え、確認を減らす,機密情報、著作権、個人情報、ハルシネーション、出力確認、利用ログを含めて教育する,D,AIリテラシー教育では、便利な使い方だけでなく、リスクと確認手順を教える必要がある。,リスク説明が不足する。,理由が分からないと実務で判断できない。,過信を助長する。,正しい。主要リスクと運用を含める。,教育は「使い方」だけでなく「使ってはいけない場面」も含む。,ミチの便利さだけでなく、知らない文が混ざる危うさも学ぶ。,AIリテラシー;従業員教育;生成AI;ハルシネーション;個人情報
G3000-R13-029,Rebuild_Set13,rebuild_50,term,監査ログ,understanding,term,stable,log_definition,AIの判断結果について、後日「なぜこの出力が返されたのか」を確認するための記録として最も適切なものはどれか。,モデルの宣伝用キャッチコピー,入力、出力、利用者、時刻、モデル版などを追跡できる監査ログ,活性化関数のグラフだけ,学習データを必ず削除する命令,B,監査ログは、入力・出力・時刻・利用者・モデル版などを追跡し、説明責任や事故対応に役立つ。,宣伝文では追跡できない。,正しい。後から判断過程を確認できる。,モデル内部の一部説明だけでは運用追跡にならない。,削除命令ではない。,ログは性能向上だけでなく、説明責任と事故対応のためにも重要。,ユイが異常文を保存したから、あとで何が起きたか辿れる。,監査ログ;トレーサビリティ;モデル版;AI判断;説明責任
G3000-R13-030,Rebuild_Set13,rebuild_50,case,ログとプライバシー,application,case,stable,log_privacy,AI利用ログを保存する際の注意点として最も適切なものはどれか。,ログには何を入れても無期限保存してよい,監査目的とプライバシー保護のバランスを取り、保存項目、期間、アクセス権を定める,ログは必ず全社員が閲覧できるようにする,ログを残すと監査できるため、個人情報保護は考えなくてよい,B,ログ保存では、監査性とプライバシー・機密保護の両立が必要である。,無限定保存はリスクが高い。,正しい。保存目的・期間・権限を管理する。,閲覧範囲を制限する必要がある。,ログにも個人情報や機密が含まれうる。,ログは安全装置であると同時に漏えいリスクにもなる。,記録を残すことと、誰にでも見せることは違う。,AIログ;監査ログ;プライバシー;アクセス制御;保存期間
G3000-R13-031,Rebuild_Set13,rebuild_50,case,ドメイン専門家,application,case,stable,domain_expert,AIモデル開発でドメイン専門家が関与する意義として最も適切なものはどれか。,専門家がいればデータは不要になる,専門家がいれば評価指標は不要になる,現場の意味、例外、ラベル品質、誤判定の重大性を判断できる,専門家がいればモデルは必ず100%正解する,C,ドメイン専門家は、データやラベルの意味、業務上のリスク、評価の妥当性を判断する役割を持つ。,データは必要。,評価指標も必要。,正しい。現場知識がAI適用を支える。,専門家がいても完全精度は保証されない。,AI開発はデータサイエンティストだけで完結しない。,四年五組の町は、歩いた子どもたちの感覚がなければ分からない。,ドメイン専門家;ラベル品質;評価指標;現場知識;AI開発
G3000-R13-032,Rebuild_Set13,rebuild_50,case,ラベル定義,application,case,stable,label_definition,不良品検知AIで、担当者によって「不良」の判断がばらついている。最初に行うべき対応として最も適切なものはどれか。,モデルを深くしてばらつきを無視する,不一致ラベルをすべてランダムに採用する,ばらつきはAIが自動で解決するため何もしない,ラベル定義、判断基準、境界事例を明確にし、アノテーション手順を合わせる,D,ラベル品質が悪いとモデル性能に影響するため、定義と手順を揃える必要がある。,モデル複雑化ではラベル矛盾を解決できない。,ランダム採用は品質低下につながる。,AIが自動で意味を統一するとは限らない。,正しい。教師データの品質を先に改善する。,教師あり学習では「正解ラベル」の質が土台。,センセイが「黒」の定義を曖昧にしたままでは、三人は同じものを探せない。,ラベル定義;アノテーション;教師あり学習;不良品検知;データ品質
G3000-R13-033,Rebuild_Set13,rebuild_50,case,アノテーション品質,application,case,stable,annotation_quality,アノテーション品質を高める施策として最も適切なものはどれか。,作業ガイドライン、複数人確認、合意率確認、難例レビューを行う,担当者ごとの自由判断だけに任せる,ラベルが足りない場合は適当に補う,正解ラベルはモデルが後から必ず修正するので確認しない,A,アノテーション品質には、基準、レビュー、合意率、難例の扱いが重要である。,正しい。ばらつきを減らす仕組みを作る。,判断基準が揺れやすい。,適当なラベルはモデルを誤学習させる。,モデルは誤った教師データから学んでしまう。,ラベルの質が悪いと、どんな高度なモデルでも崩れる。,地図に間違った印を付けたら、みんな違う場所へ行ってしまう。,アノテーション品質;合意率;ラベル;教師データ;レビュー
G3000-R13-034,Rebuild_Set13,rebuild_50,case,データカバレッジ,application,case,stable,coverage,店舗需要予測AIの学習データが都市部の大型店に偏っている。地方小型店へ展開する前に確認すべきこととして最も適切なものはどれか。,都市部で精度が高いなら確認不要,地方小型店のデータ分布、季節性、販促、顧客層が学習データで十分表現されているか確認する,モデル名を変えれば地方にも適用できる,予測対象を変えずに特徴量を全部削除する,B,学習データが適用先を代表しているかを確認しないと、分布差により性能低下が起きる。,分布が違う可能性がある。,正しい。データカバレッジの確認が必要。,モデル名では性能は変わらない。,情報を削るだけでは解決しない。,学習データの偏りは適用範囲の問題につながる。,町の中心だけを見て、山道のことまで分かった気になってはいけない。,データカバレッジ;需要予測;分布差;外部妥当性;店舗データ
G3000-R13-035,Rebuild_Set13,rebuild_50,term,外部妥当性,understanding,term,stable,validity_mix,AIモデル評価における外部妥当性に近い考え方として最も適切なものはどれか。,訓練データだけで損失が低いこと,計算機内部の配線が正しいこと,評価結果が、別環境や実運用条件にもどの程度当てはまるかという観点,モデルのファイルサイズが小さいこと,C,外部妥当性は、限定条件で得た結果が他の状況にも一般化できるかに関わる。,訓練データだけでは汎化を判断できない。,ハードウェア検査ではない。,正しい。実運用への一般化可能性を考える。,軽量化の話ではない。,PoC結果が本番でも通用するか、という観点で問われる。,温泉が一か所で湧いても、町中が温かいとは限らない。,外部妥当性;汎化;PoC;実運用;評価
G3000-R13-036,Rebuild_Set13,rebuild_50,case,A/Bテスト,application,case,stable,abtest_trap,推薦AIの新モデルを導入する前にA/Bテストを行う目的として最も適切なものはどれか。,学習データを暗号化するため,モデルの中身を必ず完全に説明するため,古いモデルを必ず削除するため,一部ユーザーで新旧施策を比較し、クリック率や購入率など実際の効果を検証するため,D,A/Bテストは、実環境で新旧施策の効果を比較する方法である。,暗号化手法ではない。,説明可能性の手法ではない。,削除が目的ではない。,正しい。実際のユーザー行動で効果を比較する。,オフライン精度と実ユーザー反応は異なる場合がある。,新しい地図を全員に配る前に、少人数で歩けるか試す。,A/Bテスト;推薦AI;クリック率;購入率;効果検証
G3000-R13-037,Rebuild_Set13,rebuild_50,case,オフライン評価とオンライン評価,understanding,case,stable,evaluation_mix,推薦モデルでオフライン評価は高かったが、オンライン導入で購入率が下がった。考えられる理由として最も適切なものはどれか。,オフライン指標が実際のユーザー行動や業務KPIを十分に反映していなかった可能性がある,オフライン評価が高いモデルはオンラインでも必ず成功する,オンライン評価はAIでは使ってはいけない,購入率はAI導入後に測定してはいけない,A,オフライン評価は重要だが、実環境の行動やKPIとずれることがある。,正しい。評価指標と実効果の不一致がある。,必ず成功するとは限らない。,オンライン評価は施策検証に有用。,導入後KPI測定は必要。,評価指標の向きがずれると「良いモデル」が悪い施策になる。,さいはての観測では見えたのに、ユイには届かないことがある。,オフライン評価;オンライン評価;推薦;KPI;A/Bテスト
G3000-R13-038,Rebuild_Set13,rebuild_50,case,段階的リリース,application,case,stable,release_strategy,高リスクなAI機能を全ユーザーへ一斉公開する前の進め方として最も適切なものはどれか。,全員へ同時公開し、問題が起きたら考える,限定ユーザーや限定地域で段階的に公開し、ログと影響を監視する,監視を止めてユーザーの反応だけを見る,失敗を避けるため評価せずに公開する,B,段階的リリースにより、影響範囲を抑えながら安全性と効果を確認できる。,影響範囲が大きくなり危険。,正しい。段階公開と監視が重要。,監視なしでは問題を見つけにくい。,評価なし公開はリスクが高い。,AIは本番に出して終わりではなく、出し方も設計対象。,四年五組でも、知らない道に全員で飛び込まず、まず足場を見る。,段階的リリース;カナリアリリース;AI運用;監視;リスク管理
G3000-R13-039,Rebuild_Set13,rebuild_50,term,カナリアリリース,understanding,term,stable,deployment_mix,カナリアリリースの説明として最も適切なものはどれか。,すべてのユーザーに同時に新モデルを配信する方法,開発環境だけで永久にテストする方法,一部のユーザーやトラフィックに先に新機能を適用し、問題を確認しながら拡大する方法,モデルの重みを鳥の画像だけで学習する方法,C,カナリアリリースは、限定範囲で新機能を公開し、影響を見ながら拡大するリリース方法である。,一斉公開ではない。,本番影響の確認ができない。,正しい。段階的公開の一種。,鳥画像の学習ではない。,名前に引っ張られず、段階公開の意味を押さえる。,黒が広がる前に、小さな変化を見て止める。,カナリアリリース;段階的リリース;AIデプロイ;モデル運用;監視
G3000-R13-040,Rebuild_Set13,rebuild_50,case,ロールバック,application,case,stable,rollback,新しいAIモデル導入後、誤判定が急増した。運用上の対応として最も適切なものはどれか。,誤判定を利用者の責任にする,問題があっても新モデルを使い続ける,ログを削除して再学習する,影響範囲を確認し、必要に応じて旧モデルへ戻すロールバックや停止を行う,D,本番障害時には、監視・影響把握・ロールバック・停止などの運用手順が必要である。,責任転嫁では解決しない。,被害が拡大する可能性がある。,ログ削除は原因究明を妨げる。,正しい。安全側へ戻す手順を持つ。,モデル更新には戻す道も必要。,さいはてで危険な経路に入ったら、戻れる道を残す必要がある。,ロールバック;AI運用;モデル更新;誤判定;インシデント対応
G3000-R13-041,Rebuild_Set13,rebuild_50,case,モデルバージョン管理,application,case,stable,versioning,AIモデルを本番運用する際のバージョン管理として最も適切なものはどれか。,モデル、学習データ、前処理、ハイパーパラメータ、評価結果、配布時期を対応づけて記録する,最新モデルだけ残し、過去情報はすべて削除する,ファイル名だけ気分で変える,モデルが深層学習ならバージョン管理は不要,A,AIではモデルだけでなく、データ・前処理・設定・評価結果を紐づけて管理することが重要である。,正しい。再現性と監査に必要。,原因追跡やロールバックが困難になる。,一貫性がなく追跡できない。,手法にかかわらず管理が必要。,AIの結果はコードだけでなくデータにも依存する。,ユイの文がいつ、どのミチから出たのかを残す必要がある。,モデルバージョン管理;MLOps;再現性;学習データ;評価結果
G3000-R13-042,Rebuild_Set13,rebuild_50,case,モデル承認ゲート,understanding,case,stable,registry,新しいAIモデルを本番環境へ反映する前に、品質部門や業務責任者の承認を必須にする狙いとして最も適切なものはどれか。,モデルの学習時間を必ずゼロにするため,性能、リスク、利用条件を確認し、未承認モデルの本番利用を防ぐため,データをすべて画像に変換するため,利用者の問い合わせをすべて禁止するため,B,承認ゲートは、モデルの性能・リスク・利用条件を確認し、統制された本番反映を行うための仕組みである。,学習時間をゼロにする仕組みではない。,正しい。承認なしの本番利用を防ぐ。,データ変換ではない。,問い合わせ禁止ではない。,MLOpsでは自動化だけでなく、承認や責任分担も重要。,ラグがイオの経路に承認点を置くように、危険な変更はそのまま通さない。,モデル承認ゲート;AIガバナンス;本番反映;MLOps;未承認モデル
G3000-R13-043,Rebuild_Set13,rebuild_50,case,特徴量ストア運用,understanding,case,stable,feature_store,複数チームが同じ顧客スコア用特徴量を別々の計算式で作っていたため、学習時と本番推論時で値がずれた。再発防止策として最も適切なものはどれか。,各チームが自由に計算式を変え続ける,特徴量の定義を口頭だけで共有する,特徴量ストアなどで定義、計算方法、版を一元管理し、学習時と推論時の一貫性を保つ,モデル評価をすべて目視だけにする,C,特徴量の定義や計算方法を管理し、学習時と推論時の不整合を防ぐことが重要である。,不整合がさらに増える。,口頭共有だけでは再現性が低い。,正しい。特徴量の定義と版を管理する。,評価方法として不十分。,特徴量ストアは単なる保存場所ではなく、一貫性と再利用性を支える仕組み。,同じ地図記号を全員が同じ意味で使わないと、町の道は読めない。,特徴量ストア;Feature Store;学習推論不整合;特徴量定義;MLOps
G3000-R13-044,Rebuild_Set13,rebuild_50,case,学習推論不整合,application,case,stable,training_serving_skew,学習時には最新の顧客属性を使っていたが、本番推論時には1か月前の属性しか取得できない。この問題として最も適切なものはどれか。,活性化関数の飽和,クラスタ数の過剰指定,画像の過学習のみ,学習時と推論時の特徴量条件が異なる学習推論不整合,D,学習時と推論時で利用できるデータや前処理が異なると、本番性能が低下する。,ニューラルネットワークの別問題。,クラスタリングの設定問題ではない。,画像だけの問題ではない。,正しい。training-serving skewに相当する。,学習時だけ使える情報を本番で使える前提にしてはいけない。,未来で見えたものを、現代のユイが使えるとは限らない。,学習推論不整合;training-serving skew;特徴量;本番推論;MLOps
G3000-R13-045,Rebuild_Set13,rebuild_50,case,データスキーマ監視,application,case,stable,schema_drift,本番AIの入力データで、ある日から年齢列が文字列として送られるようになった。最も適切な監視対象はどれか。,データスキーマや型、欠損率、値域の変化,開発者の服装,モデル名の長さ,利用者の端末壁紙,A,入力データの型や欠損、値域の変化はモデル不具合の原因になるため監視する。,正しい。スキーマ監視が必要。,関係がない。,関係がない。,関係がない。,データの中身だけでなく、列の型が変わるだけでも壊れる。,地図の線が急に文字になったら、道として読めない。,データスキーマ;型変化;データ監視;MLOps;入力データ
G3000-R13-046,Rebuild_Set13,rebuild_50,case,異常入力検知,application,case,stable,input_anomaly,本番モデルに通常範囲から大きく外れた入力が急増している。対応として最も適切なものはどれか。,モデルが自動で必ず正しく処理するので放置する,入力分布の異常を検知し、アラート、遮断、有人確認、再学習検討につなげる,外れ値をすべて正解として学習する,監視を停止して精度低下を隠す,B,異常入力は誤判定や攻撃の兆候になりうるため、監視と対応手順が必要である。,放置は危険。,正しい。異常検知と運用対応を組み合わせる。,外れ値を無条件に正解扱いしてはいけない。,隠すのではなく対応する。,本番では「入力がおかしい」ことも検知対象。,黒が広がったら、道ではなく異常として見る。,異常入力;外れ値;データ監視;アラート;有人確認
G3000-R13-047,Rebuild_Set13,rebuild_50,compare,バッチ推論とオンライン推論,understanding,compare,stable,inference_type,バッチ推論とオンライン推論の違いとして最も適切なものはどれか。,バッチ推論は必ず画像専用である,オンライン推論は学習データを必ず使わない,バッチ推論はまとめて処理し、オンライン推論はリクエストごとに即時処理することが多い,オンライン推論はAI倫理と無関係である,C,バッチ推論は定期・一括処理、オンライン推論はリアルタイム応答に使われることが多い。,画像専用ではない。,推論では学習データを直接使わない場合が多いが、区別の本質ではない。,正しい。処理タイミングが異なる。,オンライン推論でも倫理・安全性は重要。,推論方式はレイテンシや監視設計に関わる。,まとめて町を見るか、歩くたびに道を聞くかの違い。,バッチ推論;オンライン推論;リアルタイム;レイテンシ;AI運用
G3000-R13-048,Rebuild_Set13,rebuild_50,case,レイテンシ要件,application,case,stable,latency,自動運転の障害物検知AIで、レイテンシ要件が特に重要な理由として最も適切なものはどれか。,モデルの説明文を長くするため,学習データを増やすため,著作権を回避するため,判断が遅れると衝突回避など安全性に直接影響するため,D,リアルタイム制御では、精度だけでなく応答時間が安全性に関わる。,説明文の長さではない。,データ量ではない。,著作権問題ではない。,正しい。遅延は安全リスクになる。,精度が高くても遅ければ使えない場面がある。,危ない岩を見つけても、声が遅れたら間に合わない。,レイテンシ;自動運転;障害物検知;リアルタイムAI;安全性
