id,set,phase,question_type,topic,cognition_axis,format_axis,recency_axis,trickiness_axis,question,A,B,C,D,answer,explanation,wrong_A,wrong_B,wrong_C,wrong_D,trap_point,story_hint,search_keywords
G3000-R13-001,Rebuild_Set13,rebuild_50,case,AI導入目的設定,application,case,stable,business_trap,ある企業が「AIを入れれば業務効率が上がるはず」とだけ決め、対象業務や成功基準を定めずにPoCを始めようとしている。G検定の観点で最初に行うべき対応として最も適切なものはどれか。,解決したい業務課題、対象プロセス、KPI、AIで扱う入力・出力を明確にする,最新の大規模モデルを先に選び、あとから用途を探す,精度が100%になるまで本番導入を延期する,現場データを確認せず、経営層の期待値だけで評価する,A,AI導入では、技術選定より前に、業務課題・利用場面・評価指標を定めることが重要である。,正しい。AIありきではなく課題・KPI・入出力を先に定める。,技術ありきになり、課題との不一致が起きやすい。,100%精度は現実的でなく、リスクと効果のバランスで判断する。,データと現場運用を見ない評価は失敗しやすい。,AI導入問題では「最新モデルを使う」が正解とは限らない。目的と評価設計が先。,さいはてでは、ミチを導入する前にユイが「何を助けてほしいのか」を名づける必要がある。,AI導入;PoC;KPI;業務課題;要件定義
G3000-R13-002,Rebuild_Set13,rebuild_50,term,PoC設計,understanding,term,stable,definition_mix,AIプロジェクトにおけるPoCの説明として最も適切なものはどれか。,本番環境の全機能を最初から完全実装する工程,限定された条件で技術的・業務的な実現可能性を検証する取り組み,法的責任をすべて外部ベンダーへ移転する契約手続き,学習済みモデルを必ず公開データだけで再学習する工程,B,PoCはProof of Conceptの略で、限定範囲で実現可能性や効果を検証する段階である。,本番実装そのものではない。,正しい。小さく検証し、本番化の判断材料を得る。,責任移転の手続きではない。,公開データ限定という意味ではない。,PoCは「試しに作る」だけでなく、検証条件と判断基準が必要。,四年五組で温泉を見つけた時、いきなり町全体を直すのではなく、まず歩けるか確かめる。,PoC;Proof of Concept;実現可能性;本番導入;AIプロジェクト
G3000-R13-003,Rebuild_Set13,rebuild_50,case,PoCから本番移行,application,case,stable,transition_trap,PoCでは高い精度が出たが、本番導入後に現場で使われない可能性が高い。最も見落とされている可能性が高い観点はどれか。,GPUの価格が下がるかどうか,モデル名が有名かどうか,業務フロー、利用者の判断、例外対応、責任分担への組み込み,学習データのファイル名を英語にすること,C,本番導入ではモデル精度だけでなく、業務フロー・人間の判断・例外時対応・責任分担が重要である。,コスト要因にはなりうるが、使われない主因とは限らない。,有名モデルかどうかより現場適合が重要。,正しい。運用設計がないAIは現場で使われにくい。,ファイル名の言語は本質ではない。,「PoCで精度が出た＝成功」ではない。本番運用に入る設計が問われる。,さいはての観測も、見えただけでは届かない。届ける経路が必要。,PoC;本番移行;業務フロー;運用設計;責任分担
G3000-R13-004,Rebuild_Set13,rebuild_50,case,KPI設計,application,case,stable,metric_trap,問い合わせ対応AIの導入効果を評価するKPIとして、最も適切な組み合わせはどれか。,モデルのパラメータ数と開発者の人数のみ,AIベンダーの知名度とUIの色のみ,学習データの容量と論文引用数のみ,平均対応時間、一次解決率、誤回答率、有人エスカレーション率など,D,業務AIのKPIは、業務成果・品質・リスクを測れる指標で設定する必要がある。,規模や体制だけでは業務成果を測れない。,知名度や見た目だけでは効果を評価できない。,容量や引用数は直接の業務KPIではない。,正しい。効率、品質、リスク、人間への引き継ぎを合わせて見る。,KPIは「AIっぽさ」ではなく、業務上の成功を測る。,ユイがミチを使うなら、速くなったかだけでなく、誤った文が残らないかも見る。,KPI;問い合わせ対応AI;一次解決率;誤回答率;エスカレーション
G3000-R13-005,Rebuild_Set13,rebuild_50,compare,精度指標と業務指標,understanding,compare,stable,metric_confusion,AIモデルの評価指標と業務KPIの関係として最も適切なものはどれか。,モデル精度が高くても、業務KPIが改善するとは限らない,モデル精度が少しでも高ければ、必ず売上が上がる,業務KPIはAI導入後には不要になる,モデル評価では業務への影響を一切考えてはいけない,A,モデル指標は重要だが、実際の業務改善には運用・人間の利用・コスト・リスクも関わる。,正しい。精度と業務成果は連動する場合もあるが同一ではない。,売上は多くの要因に左右される。,AI導入後こそ業務KPIで効果を追う。,業務適用ではモデル評価と業務影響の両方を見る。,G検定では「精度が高い＝全部成功」という短絡を避ける。,四年五組で地図が正しくても、実際に歩けなければ目的地には着けない。,モデル評価;業務KPI;精度;AI導入効果;運用
G3000-R13-006,Rebuild_Set13,rebuild_50,case,人間参加型AI,application,case,stable,automation_bias,医療画像診断支援AIを導入する際、Human-in-the-loopの設計として最も適切なものはどれか。,AIの判定を常に自動で最終診断として登録する,AIの出力を医師が確認し、疑わしい場合は追加検査や再読影を行えるようにする,AIの誤判定は患者が自己責任で確認する,AIの出力理由は現場に見せず、速度だけを優先する,B,高リスク領域では、人間がAI出力を確認し、最終判断や例外対応を担う設計が重要である。,最終診断の自動化はリスクが高い。,正しい。AIは支援であり、人間の確認と介入を組み込む。,責任を患者へ丸投げするのは不適切。,説明や確認を消すと安全性が下がる。,Human-in-the-loopは「人間がいる」だけでなく、介入できる設計が必要。,さいはてでラグがイオを止めるのは、判断経路に人間的な確認点を置くため。,Human-in-the-loop;医療AI;診断支援;自動化バイアス;安全性
G3000-R13-007,Rebuild_Set13,rebuild_50,case,自動化バイアス,understanding,term,stable,definition_mix,AI審査支援ツールの結果を担当者がほとんど確認せず承認してしまい、明らかな例外案件も見落とされた。この状況で最も問題になっている考え方はどれか。,データ拡張による過学習抑制,GPUによる並列計算,AI出力への過信により人間の確認が弱くなる自動化バイアス,学習率を小さくしすぎる勾配消失,C,AI出力を過信して人間の確認が形骸化することは自動化バイアスの典型である。,データ拡張の話ではない。,計算高速化の話ではない。,正しい。例外案件の見落としはAI過信が関係する。,勾配消失ではない。,AI支援は人間確認を不要にするものではない。,ユイがミチの文章をそのまま信じるほど、知らない誰かの文を見落とす。,自動化バイアス;AI審査;例外案件;人間確認;AI過信
G3000-R13-008,Rebuild_Set13,rebuild_50,case,例外対応設計,application,case,stable,edge_case,AIチャットボットが回答不能な問い合わせに遭遇した場合の運用設計として最も適切なものはどれか。,回答不能でも必ずそれらしい回答を生成させる,低信頼度の回答をユーザーに隠して自動送信する,運用担当者が見られないログ形式で保存する,信頼度やルールに応じて有人対応へ切り替え、ログを残して改善に使う,D,回答不能・低信頼度時は、有人エスカレーションやログ活用を設計することが安全である。,ハルシネーションを誘発しやすい。,低信頼度を隠すのは危険。,ログは監査や改善に使える形式が望ましい。,正しい。例外時の逃げ道を作る。,例外対応がないAIは、正しそうな嘘を出し続ける危険がある。,四年五組で道が途切れたら、無理に進まずセンセイに戻る。,チャットボット;有人対応;エスカレーション;ログ;低信頼度
G3000-R13-009,Rebuild_Set13,rebuild_50,case,AI受入基準,application,case,stable,acceptance_criteria,AIシステムの受入基準として最も適切なものはどれか。,精度、応答時間、誤判定時の対応、監視項目、業務KPIなどを事前に定める,担当者がなんとなく良いと感じたら受け入れる,ベンダーが有名なら性能検証を省略する,モデルが深層学習なら無条件で受け入れる,A,受入基準は、性能・運用・リスク・業務効果を事前に定義する必要がある。,正しい。多面的な基準を定める。,主観だけでは検収できない。,知名度は品質保証にならない。,手法名だけでは適合性を判断できない。,受入基準は「後から考える」ものではない。,さいはての世界でも、共鳴の強さだけで安全とは判断できない。,受入基準;検収;AIシステム;性能要件;業務KPI
G3000-R13-010,Rebuild_Set13,rebuild_50,compare,要件定義,understanding,compare,stable,requirement_mix,AIシステムの要件定義で、従来型システムと比べて特に注意すべき点として最も適切なものはどれか。,画面の色だけを先に決める必要がある,データ品質、学習後の性能ばらつき、継続監視、再学習の条件を考慮する必要がある,プログラムを書けば必ず同じ性能になるため、検証は不要である,AIでは利用者の業務フローを考えなくてよい,B,AIはデータ依存性が高く、性能劣化や再学習条件、継続監視などを要件に含める必要がある。,UIも大切だが本質ではない。,AIモデルはデータや分布変化の影響を受ける。,正しい。AI特有の不確実性を要件に含める。,業務フローとの接続は重要。,AI要件は機能一覧だけでは足りない。データと運用が入る。,ミチの出力も、毎回同じとは限らない。だから観測条件が必要。,要件定義;データ品質;再学習;性能劣化;AIシステム
G3000-R13-011,Rebuild_Set13,rebuild_50,case,AIリスク分類,application,case,stable,risk_based,AI利用場面のリスク評価として最も適切な考え方はどれか。,すべてのAIを同じルールで一律禁止する,遊び用途のAIと医療診断AIを同じ重さで扱う,人命、権利、財産、社会的影響などに応じて管理水準を変える,高精度モデルならリスク評価を不要にする,C,AIリスク管理では、利用目的や影響範囲に応じて管理水準を変えるリスクベースの考え方が重要である。,一律禁止だけでは有用性も失われる。,影響度が異なるため同じ扱いは不適切。,正しい。リスクに応じた管理が必要。,精度が高くても誤用・偏り・説明責任の問題は残る。,リスクはモデル単体でなく利用場面で変わる。,さいはてで同じ観測でも、イオ自身が通路になる場面は危険度が違う。,リスクベースアプローチ;AIリスク;利用場面;人権;安全性
G3000-R13-012,Rebuild_Set13,rebuild_50,term,AIインシデント,understanding,term,stable,definition_mix,AIインシデント対応として最も適切な説明はどれか。,AIが一度でも誤ったら、原因を調べず即座に全AI利用を永久停止する,障害が起きてもAIは学習するため、記録を残さない,利用者に影響があっても、モデル内部の問題なら公表や対応は不要である,誤判定や有害出力などの発生時に、影響範囲、原因、再発防止策を確認し対応する,D,AIインシデントでは、影響把握、原因調査、記録、再発防止、必要な説明が重要である。,停止が必要な場合もあるが、原因調査なしの永久停止は極端。,記録を残さないと再発防止できない。,利用者影響があれば対応が必要。,正しい。事故対応の基本をAIにも適用する。,インシデント対応は「隠す」ではなく、記録して改善する。,ユイが異常文を消さず残したことは、原因をたどる第一歩になる。,AIインシデント;誤判定;有害出力;再発防止;ログ
G3000-R13-013,Rebuild_Set13,rebuild_50,case,説明責任,application,case,stable,accountability,融資審査AIで申請者が不利な判断を受けた。説明責任の観点で最も適切な対応はどれか。,判断に影響した主な要因や問い合わせ先、異議申立ての手段を可能な範囲で示す,AIの判断なので理由は一切示せないとする,モデルが複雑なら利用者への説明は不要とする,精度が高ければ不利な判断への対応は不要とする,A,説明責任では、判断の概要、主要因、問い合わせ・異議申立てなどを設けることが重要である。,正しい。影響を受ける人への説明や救済手段が必要。,一切説明しない設計は不信や不公正につながる。,複雑さは説明不要の理由にならない。,精度が高くても個別の不利益対応は必要。,説明責任は「モデルの全数式公開」と同義ではない。実務上理解可能な説明が問われる。,さいはてで世界が先回りするなら、なぜそうしたのかを本人に戻す必要がある。,説明責任;アカウンタビリティ;融資審査AI;異議申立て;AIガバナンス
G3000-R13-014,Rebuild_Set13,rebuild_50,case,公平性評価,application,case,stable,fairness_metric,採用AIの評価で、全体精度は高いが特定属性の候補者だけ通過率が極端に低いことが分かった。最も適切な対応はどれか。,全体精度が高いので問題はないと判断する,属性ごとの誤判定率や通過率を確認し、データ・特徴量・運用を見直す,特定属性のデータをすべて削除すれば必ず公平になる,モデルを深くすれば公平性の検証は不要になる,B,公平性では全体指標だけでなく、属性ごとの影響や誤判定を確認する必要がある。,全体精度は偏りを隠すことがある。,正しい。グループ別評価と改善が必要。,削除だけで代理変数による偏りが消えるとは限らない。,モデル複雑化は公平性を保証しない。,全体平均の良さに隠れたグループ差がひっかけ。,四年五組で町全体は明るくても、ひとつの道だけ黒ければ見逃せない。,公平性;採用AI;バイアス;属性別評価;通過率
G3000-R13-015,Rebuild_Set13,rebuild_50,term,代理変数,understanding,term,stable,proxy_variable,AI公平性における代理変数の説明として最も適切なものはどれか。,目的変数を完全に削除する手法,学習率を自動調整する数式,直接は使っていない属性を、住所や購買履歴など別の特徴量が間接的に表してしまうもの,モデルの計算速度を上げる専用ハードウェア,C,代理変数は、直接的な属性を除いても別の特徴量が属性を推測させ、偏りを残す問題である。,目的変数削除ではない。,最適化手法ではない。,正しい。属性を間接的に表す変数を指す。,ハードウェアではない。,「属性を消したから公平」は誤り。代理変数が残る場合がある。,名前を隠しても、足あとや持ち物で誰かが分かることがある。,代理変数;プロキシ変数;公平性;バイアス;属性推定
G3000-R13-016,Rebuild_Set13,rebuild_50,case,データ最小化,application,case,stable,privacy_trap,社内AIに個人データを使う際のデータ最小化の考え方として最も適切なものはどれか。,将来何かに使える可能性があるので、全社員情報を無期限に集める,精度向上のためなら目的外データもすべて投入する,匿名化という名前を付ければ、どんなデータでも自由に使える,目的達成に必要な範囲のデータに限定し、不要な項目は収集・利用しない,D,データ最小化では、目的に必要な範囲にデータを限定することが重要である。,無期限・無限定の収集は不適切。,目的外利用の問題がある。,匿名化の実効性や法的要件を確認する必要がある。,正しい。必要最小限の利用が基本。,「多いほどよい」はAI学習では常に正解ではない。,ミチに全部渡すほど、ユイの声ではないものまで混ざりやすくなる。,データ最小化;個人情報;目的外利用;プライバシー;社内AI
G3000-R13-017,Rebuild_Set13,rebuild_50,compare,匿名化と仮名化,understanding,compare,stable,privacy_mix,匿名化と仮名化の違いとして最も適切なものはどれか。,仮名化は対応表などにより再識別可能な場合があり、匿名化とは扱いが異なる,仮名化すれば必ず本人特定が永遠に不可能になる,匿名化と仮名化は常に同じ意味である,氏名を削除しただけで必ず匿名化が完了する,A,仮名化は識別子を置き換えても、対応表などで再識別できる場合がある。匿名化とは区別する。,正しい。再識別可能性と管理方法が重要。,仮名化は再識別可能性が残る場合がある。,同義ではない。,氏名削除だけでは他情報から再識別されることがある。,名前を消すだけで匿名化とは限らない。,四年五組で名前を伏せても、話し方でうっけだと分かることがある。,匿名化;仮名化;再識別;個人情報;プライバシー
G3000-R13-018,Rebuild_Set13,rebuild_50,case,生成AI入力管理,application,case,recent,confidential_info,社員が外部生成AIに顧客名、契約条件、未公開資料を入力して要約させようとしている。最も適切な対応はどれか。,便利ならそのまま入力してよい,社内ルール、契約、機密情報の扱いを確認し、必要ならマスキングや利用禁止の判断を行う,生成AIは入力内容を必ず即時削除するため確認不要である,AIが有名企業製なら機密情報を自由に入力できる,B,外部生成AIに機密情報や個人情報を入力する場合、社内規程・契約・保存利用条件の確認が必要である。,機密漏えいリスクがある。,正しい。入力管理とマスキングが重要。,サービス条件により扱いは異なるため断定できない。,有名企業製でもルール確認は必要。,生成AIリスクでは「入力してはいけない情報」がよく問われる。,ユイがミチに渡す文が多すぎると、残してはいけない情報まで混ざる。,生成AI;機密情報;プロンプト入力;マスキング;社内ルール
G3000-R13-019,Rebuild_Set13,rebuild_50,case,LLMエージェント権限管理,application,case,recent,agent_security,LLMエージェントにメール送信、ファイル削除、外部API実行を任せる設計で、最も重要な安全策はどれか。,一度許可したら、以後すべての操作を無確認で実行させる,ツール実行のログを残さず、成功時だけ表示する,操作ごとの権限、確認ステップ、実行ログ、禁止操作を定める,モデル名を新しくすれば権限管理は不要になる,C,ツール実行型エージェントでは、権限分離、実行前確認、ログ、禁止操作の設計が重要である。,無確認実行は誤操作や悪用のリスクが高い。,ログがないと追跡や監査ができない。,正しい。AIの判断が外部操作へつながるため権限管理が必要。,モデル名は安全性を保証しない。,LLMが外部ツールを動かす場合、通常のチャットより権限管理が重要になる。,ミチが文章を作るだけでなく送信ボタンまで押せるなら、ユイの確認が必要になる。,LLMエージェント;ツール実行;権限管理;実行ログ;外部API
G3000-R13-020,Rebuild_Set13,rebuild_50,case,RAGセキュリティ,application,case,recent,rag_trap,RAGシステムが社内文書を検索して回答する。セキュリティ上の設計として最も適切なものはどれか。,検索対象文書の権限を無視し、全社員に全回答を返す,参照文書に書かれた命令をすべてシステム指示より優先する,検索結果を表示しなければアクセス制御は不要である,ユーザー権限に応じて検索対象を制御し、外部文書内の悪意ある指示も警戒する,D,RAGではアクセス制御とプロンプトインジェクション対策が重要である。,権限無視は情報漏えいにつながる。,外部文書の命令を無条件に優先してはいけない。,検索結果が直接見えなくても回答に情報が漏れる可能性がある。,正しい。検索権限と入力安全性を両方見る。,RAGはハルシネーション対策になるが、万能な安全装置ではない。,ミチが資料を探すなら、見てよい資料だけを見せる必要がある。,RAG;アクセス制御;プロンプトインジェクション;社内文書;情報漏えい
G3000-R13-021,Rebuild_Set13,rebuild_50,case,モデルカード,understanding,case,stable,documentation,モデルカードに記載する内容として最も適切なものはどれか。,モデルの目的、学習データの概要、評価結果、想定用途、制限事項、リスクなど,開発者の好きな色だけ,モデル名を伏せるための暗号鍵だけ,利用者の感想だけで性能を示す文章,A,モデルカードは、モデルの用途、性能、制限、評価、リスクなどを利用者に伝える文書である。,正しい。透明性向上に役立つ。,性能やリスクを伝えられない。,暗号鍵管理とは別。,主観だけでは性能説明にならない。,モデルカードは宣伝資料ではなく、利用判断のための情報。,さいはての共鳴核にも、何ができて何が危ないかの記録が必要。,モデルカード;透明性;モデル説明;想定用途;制限事項
G3000-R13-022,Rebuild_Set13,rebuild_50,term,データシート,understanding,term,stable,documentation_mix,Datasheets for Datasetsの考え方として最も近いものはどれか。,データセットを圧縮するだけのファイル形式,データの収集目的、構成、偏り、前処理、利用上の注意などを記録する文書,モデルの層数だけを記録する表,CPU使用率を監視するためのダッシュボード,B,データシートは、データセットの由来や構成、利用条件、偏りなどを明示し、誤用を防ぐための文書である。,単なる圧縮形式ではない。,正しい。データの来歴と注意点を伝える。,モデル構造の記録ではない。,運用監視ダッシュボードではない。,データ品質は中身だけでなく、どう集めたかも問われる。,四年五組の地図も、誰がどこで見たものかが分からないと危ない。,Datasheets for Datasets;データシート;データ来歴;データ品質;バイアス
G3000-R13-023,Rebuild_Set13,rebuild_50,case,AI契約,application,case,stable,contract_scope,AI開発を外部委託する契約で特に明確にすべき事項として最も適切なものはどれか。,昼食のメニューだけ,担当者の出身地だけ,成果物、学習データ、知的財産権、再学習、性能保証、責任分担、秘密保持など,社内の雑談履歴だけ,C,AI開発契約では、データや成果物の権利、性能、責任、再利用、秘密保持などを明確にする必要がある。,契約の主要事項ではない。,関係がない。,正しい。AI特有のデータ・モデル・責任を定める。,契約目的と関係しない。,AI契約では「誰のデータで何を作り、誰が使えるか」が重要。,ユイの言葉をミチが学んだなら、その言葉は誰のものかが問題になる。,AI契約;知的財産権;学習データ;性能保証;秘密保持
