id,set,phase,question_type,topic,cognition_axis,format_axis,recency_axis,trickiness_axis,question,A,B,C,D,answer,explanation,wrong_A,wrong_B,wrong_C,wrong_D,trap_point,story_hint,search_keywords
G3000-R42-019,Rebuild_Set42,rebuild,case,継続学習/破滅的忘却,設計判断,複合ケース,中,高,新しいデータだけでモデルを追加学習したところ、以前よく当たっていた古いパターンの精度が急落した。関連する概念として最も適切なものはどれか。,データ拡張,破滅的忘却,正則化係数の単位変換,ランダムシード固定,B,新しいタスクや分布に適応する過程で、以前学習した知識を失う現象は破滅的忘却と呼ばれる。,Aは不適切。データ拡張は、この設問で問う条件を満たさない。,正解。,Cは不適切。正則化係数の単位変換は、この設問で問う条件を満たさない。,Dは不適切。ランダムシード固定は、この設問で問う条件を満たさない。,新データで学習すれば必ず全体が良くなる、という見方がひっかけ。,さいはての未来では、便利な共鳴世界ほど観測・検証・責任の線引きが必要になる、と戻して覚える。,破滅的忘却;継続学習;追加学習;分布変化;モデル更新
G3000-R42-020,Rebuild_Set42,rebuild,case,データ最小化/プライバシー,法務判断,複合ケース,高,中,AIチャットログを改善目的で保存する際、個人情報や機密が混ざる可能性がある。最も適切な対応はどれか。,改善に役立つ可能性があるため、全ログを無期限に保存する,目的を明確にし、必要最小限の保存・マスキング・アクセス制御を行う,ログはAIが扱うので個人情報保護の対象外である,暗号化すれば利用目的の説明は不要になる,B,ログ保存では、利用目的、保存期間、最小化、マスキング、アクセス制御などが重要になる。,Aは不適切。改善に役立つ可能性があるため、全ログを無期限に保存するは、この設問で問う条件を満たさない。,正解。,Cは不適切。ログはAIが扱うので個人情報保護の対象外であるは、この設問で問う条件を満たさない。,Dは不適切。暗号化すれば利用目的の説明は不要になるは、この設問で問う条件を満たさない。,暗号化だけで全てのプライバシー要件を満たす、という選択肢がひっかけ。,さいはての未来では、便利な共鳴世界ほど観測・検証・責任の線引きが必要になる、と戻して覚える。,データ最小化;チャットログ;個人情報;マスキング;アクセス制御
G3000-R42-021,Rebuild_Set42,rebuild,case,多クラス評価/混同行列,評価判断,複合ケース,中,中,3種類の故障を分類するモデルで、全体精度は高いが、重大故障だけ見逃しが多い。見るべき指標として最も適切なものはどれか。,全体のファイルサイズ,重大故障クラスの再現率や混同行列,訓練に使ったGPUのメーカー,モデル名の知名度,B,重大故障の見逃しが問題なら、そのクラスの再現率や混同行列で誤分類傾向を見る必要がある。,Aは不適切。全体のファイルサイズは、この設問で問う条件を満たさない。,正解。,Cは不適切。訓練に使ったGPUのメーカーは、この設問で問う条件を満たさない。,Dは不適切。モデル名の知名度は、この設問で問う条件を満たさない。,全体精度だけで安全性を判断するのがひっかけ。,さいはての未来では、便利な共鳴世界ほど観測・検証・責任の線引きが必要になる、と戻して覚える。,多クラス分類;混同行列;再現率;重大故障;評価指標
G3000-R42-022,Rebuild_Set42,rebuild,case,RAG/更新管理,運用判断,複合ケース,高,中,社内規程が更新されたのに、RAG Botが古い条文に基づいて回答し続けた。運用上必要な仕組みはどれか。,LLMの温度を高くして最新情報を想像させる,文書更新、インデックス再作成、回答根拠の版管理を行う,古い文書も新しい文書も区別せず同じ検索対象にする,根拠表示を消してユーザーに気づかせない,B,RAGでは参照文書の更新、インデックス更新、版管理が重要である。古い根拠を参照すると誤回答につながる。,Aは不適切。LLMの温度を高くして最新情報を想像させるは、この設問で問う条件を満たさない。,正解。,Cは不適切。古い文書も新しい文書も区別せず同じ検索対象にするは、この設問で問う条件を満たさない。,Dは不適切。根拠表示を消してユーザーに気づかせないは、この設問で問う条件を満たさない。,LLMが自動で最新規程を知る、という思い込みがひっかけ。,さいはての未来では、便利な共鳴世界ほど観測・検証・責任の線引きが必要になる、と戻して覚える。,RAG;インデックス更新;版管理;社内規程;根拠表示
G3000-R42-023,Rebuild_Set42,rebuild,case,強化学習/安全制約,安全判断,複合ケース,中,高,倉庫ロボットを強化学習で制御する際、報酬最大化だけに任せると危険行動を学ぶ可能性がある。必要な考え方はどれか。,報酬を高くすれば安全性も必ず高まる,安全制約や禁止行動を設計し、実環境前に十分検証する,学習中の衝突は探索なので制限しない,シミュレーション結果があれば実機検証は不要である,B,強化学習では報酬設計だけでなく、安全制約やシミュレーション・実機検証が重要である。,Aは不適切。報酬を高くすれば安全性も必ず高まるは、この設問で問う条件を満たさない。,正解。,Cは不適切。学習中の衝突は探索なので制限しないは、この設問で問う条件を満たさない。,Dは不適切。シミュレーション結果があれば実機検証は不要であるは、この設問で問う条件を満たさない。,報酬最大化を安全性と同一視するのがひっかけ。,さいはての未来では、便利な共鳴世界ほど観測・検証・責任の線引きが必要になる、と戻して覚える。,強化学習;報酬設計;安全制約;倉庫ロボット;実機検証
G3000-R42-024,Rebuild_Set42,rebuild,case,合成データ/バイアス,評価判断,複合ケース,高,高,希少疾患データ不足を補うため合成データを作った。利用前に確認すべきことはどれか。,合成データなら個人情報やバイアスの検討は常に不要である,合成データが実データ分布や少数群の特徴を歪めていないか評価する,生成枚数が多ければ品質評価は不要である,合成データだけで現実世界の性能は保証される,B,合成データは有用だが、分布の歪み、バイアス、プライバシー、実データでの評価が必要になる。,Aは不適切。合成データなら個人情報やバイアスの検討は常に不要であるは、この設問で問う条件を満たさない。,正解。,Cは不適切。生成枚数が多ければ品質評価は不要であるは、この設問で問う条件を満たさない。,Dは不適切。合成データだけで現実世界の性能は保証されるは、この設問で問う条件を満たさない。,データ量が増えれば品質問題が消える、という選択肢がひっかけ。,さいはての未来では、便利な共鳴世界ほど観測・検証・責任の線引きが必要になる、と戻して覚える。,合成データ;希少疾患;バイアス;データ分布;プライバシー
G3000-R42-025,Rebuild_Set42,rebuild,case,学習率/運用診断,読解判断,複合ケース,中,中,訓練中、損失が大きく上下して収束しない。まず疑うべき原因の一つとして最も適切なものはどれか。,テストデータが多すぎるため必ず収束しない,学習率が大きすぎる可能性,正解ラベルがあるため教師なし学習になっている,モデルを小さくすれば損失は必ず振動する,B,学習率が大きすぎると最適値を飛び越えて損失が不安定になることがある。,Aは不適切。テストデータが多すぎるため必ず収束しないは、この設問で問う条件を満たさない。,正解。,Cは不適切。正解ラベルがあるため教師なし学習になっているは、この設問で問う条件を満たさない。,Dは不適切。モデルを小さくすれば損失は必ず振動するは、この設問で問う条件を満たさない。,損失の振動をデータ量だけで説明する選択肢がひっかけ。,さいはての未来では、便利な共鳴世界ほど観測・検証・責任の線引きが必要になる、と戻して覚える。,学習率;損失関数;勾配降下法;収束;最適化
G3000-R42-026,Rebuild_Set42,rebuild,case,転移学習/ドメイン差,設計判断,複合ケース,中,中,一般画像で事前学習したモデルを医療画像に使ったところ、期待ほど性能が出ない。考えるべきことはどれか。,事前学習済みモデルはどの領域でも必ず最高精度になる,事前学習データと対象ドメインの差を踏まえ、追加学習や評価を行う,医療画像ではテストデータが不要になる,転移学習ではラベル品質は関係しない,B,転移学習は有効だが、事前学習ドメインと対象ドメインの差が大きいと性能が出ないことがある。,Aは不適切。事前学習済みモデルはどの領域でも必ず最高精度になるは、この設問で問う条件を満たさない。,正解。,Cは不適切。医療画像ではテストデータが不要になるは、この設問で問う条件を満たさない。,Dは不適切。転移学習ではラベル品質は関係しないは、この設問で問う条件を満たさない。,転移学習を万能とみなすのがひっかけ。,さいはての未来では、便利な共鳴世界ほど観測・検証・責任の線引きが必要になる、と戻して覚える。,転移学習;事前学習;ドメイン差;医療画像;追加学習
G3000-R42-027,Rebuild_Set42,rebuild,case,LLM/コンテキスト制限,設計判断,複合ケース,高,中,長い議事録をLLMに一括投入したところ、冒頭の重要事項が回答に反映されなかった。設計上考えるべき観点はどれか。,長文を入れれば必ず全情報が均等に扱われる,出力を長くすれば入力の取りこぼしは消える,コンテキスト長、分割要約、重要情報の保持方法を設計する,LLMでは入力順序や長さは一切影響しない,C,LLMにはコンテキスト長や注意の偏りがあり、長文処理では分割・要約・根拠管理が必要である。,Aは不適切。長文を入れれば必ず全情報が均等に扱われるは、この設問で問う条件を満たさない。,Bは不適切。出力を長くすれば入力の取りこぼしは消えるは、この設問で問う条件を満たさない。,正解。,Dは不適切。LLMでは入力順序や長さは一切影響しないは、この設問で問う条件を満たさない。,長く入れれば全部読める、という思い込みがひっかけ。,さいはての未来では、便利な共鳴世界ほど観測・検証・責任の線引きが必要になる、と戻して覚える。,LLM;コンテキスト長;議事録要約;長文処理;分割要約
G3000-R42-028,Rebuild_Set42,rebuild,case,外れ値/ロバスト性,評価判断,複合ケース,中,中,センサーデータに一時的な異常値が混入し、回帰モデルの予測が大きく乱れた。検討すべき対応はどれか。,外れ値は必ず正しい情報なので何も確認しない,分類モデルにすれば外れ値の影響は常に消える,外れ値処理やロバストな損失関数、異常値検知を検討する,データを時系列順に並べ替えれば外れ値は消える,C,外れ値は予測を不安定にすることがある。前処理やロバストな手法を検討する。,Aは不適切。外れ値は必ず正しい情報なので何も確認しないは、この設問で問う条件を満たさない。,Bは不適切。分類モデルにすれば外れ値の影響は常に消えるは、この設問で問う条件を満たさない。,正解。,Dは不適切。データを時系列順に並べ替えれば外れ値は消えるは、この設問で問う条件を満たさない。,外れ値を無条件で削除・無条件で採用する両極端がひっかけ。,さいはての未来では、便利な共鳴世界ほど観測・検証・責任の線引きが必要になる、と戻して覚える。,外れ値;ロバスト性;回帰モデル;センサーデータ;異常値検知
G3000-R42-029,Rebuild_Set42,rebuild,case,ランキング評価,評価設計,複合ケース,中,中,検索システムで、正しい文書が検索結果の下位に出るため利用者が見つけにくい。評価指標として重視すべきものはどれか。,訓練エポック数だけ,文書ファイル名の長さ,上位順位での適合性を評価する指標,LLMの語彙サイズだけ,C,検索では、単に含まれるかだけでなく、上位に出るかが重要である。ランキング指標が必要になる。,Aは不適切。訓練エポック数だけは、この設問で問う条件を満たさない。,Bは不適切。文書ファイル名の長さは、この設問で問う条件を満たさない。,正解。,Dは不適切。LLMの語彙サイズだけは、この設問で問う条件を満たさない。,検索評価を分類の正解率だけで考えるのがひっかけ。,さいはての未来では、便利な共鳴世界ほど観測・検証・責任の線引きが必要になる、と戻して覚える。,検索評価;ランキング;上位適合率;RAG;情報検索
G3000-R42-030,Rebuild_Set42,rebuild,case,監査ログ/追跡性,運用判断,複合ケース,中,中,AIが出した判断に対して、後から『どの入力・モデル版・根拠で判断したか』を確認する必要がある。必要な仕組みはどれか。,出力だけを保存し、入力やモデル版は保存しない,ログを残すと責任が生じるので全て削除する,入力、出力、モデル版、参照データ、実行時刻を追跡できるログ,モデル名だけを画面に表示すれば十分である,C,監査可能性には、判断時の入力、出力、モデル・データ版、根拠、時刻などの追跡が必要である。,Aは不適切。出力だけを保存し、入力やモデル版は保存しないは、この設問で問う条件を満たさない。,Bは不適切。ログを残すと責任が生じるので全て削除するは、この設問で問う条件を満たさない。,正解。,Dは不適切。モデル名だけを画面に表示すれば十分であるは、この設問で問う条件を満たさない。,ログ削除をリスク低減と誤解する選択肢がひっかけ。,さいはての未来では、便利な共鳴世界ほど観測・検証・責任の線引きが必要になる、と戻して覚える。,監査ログ;追跡性;モデル版管理;AIガバナンス;説明責任
G3000-R42-031,Rebuild_Set42,rebuild,case,マルチモーダル/評価,評価設計,複合ケース,高,高,画像とテキストを入力するマルチモーダルAIが、画像内の文字を誤読して回答を誤った。評価で確認すべき観点はどれか。,出力文が自然なら画像理解は正しいとみなす,テキストモデルなので画像評価は不要である,画像認識、OCR、言語推論のどこで誤りが起きたかを分けて確認する,マルチモーダルAIでは評価指標は一つだけで十分である,C,マルチモーダルAIでは、画像理解、OCR、テキスト推論など複数段階の誤りを分けて見ることが重要である。,Aは不適切。出力文が自然なら画像理解は正しいとみなすは、この設問で問う条件を満たさない。,Bは不適切。テキストモデルなので画像評価は不要であるは、この設問で問う条件を満たさない。,正解。,Dは不適切。マルチモーダルAIでは評価指標は一つだけで十分であるは、この設問で問う条件を満たさない。,自然な説明と画像理解の正しさを混同するのがひっかけ。,さいはての未来では、便利な共鳴世界ほど観測・検証・責任の線引きが必要になる、と戻して覚える。,マルチモーダルAI;OCR;画像理解;評価設計;誤り分析
G3000-R42-032,Rebuild_Set42,rebuild,case,A/Bテスト/倫理,運用判断,複合ケース,中,高,医療情報サイトでAI回答の文言をA/Bテストしたい。適切な注意として最も重要なものはどれか。,クリック率が高ければ医療情報として正しいとみなす,医療分野でもA/Bテストなら専門家確認は不要である,利用者に不利益が出ないよう、安全性・倫理・監修体制を確認する,片方の文言が危険でも実験なので問題ない,C,医療など高リスク領域では、クリック率だけでなく安全性、正確性、専門家監修、利用者保護が重要である。,Aは不適切。クリック率が高ければ医療情報として正しいとみなすは、この設問で問う条件を満たさない。,Bは不適切。医療分野でもA/Bテストなら専門家確認は不要であるは、この設問で問う条件を満たさない。,正解。,Dは不適切。片方の文言が危険でも実験なので問題ないは、この設問で問う条件を満たさない。,ビジネス指標を安全性より優先する選択肢がひっかけ。,さいはての未来では、便利な共鳴世界ほど観測・検証・責任の線引きが必要になる、と戻して覚える。,A/Bテスト;医療AI;倫理;安全性;専門家監修
G3000-R42-033,Rebuild_Set42,rebuild,case,キャリブレーション,評価判断,複合ケース,中,高,分類モデルが『90%の確率で陽性』と出すが、実際にはそのような予測の正解率が60%程度だった。確認すべき性質はどれか。,GPUメモリの断片化,データベースの正規化,確率出力の校正、キャリブレーション,画像の解像度だけ,C,確率予測が実際の頻度と合っているかを見る性質をキャリブレーションという。,Aは不適切。GPUメモリの断片化は、この設問で問う条件を満たさない。,Bは不適切。データベースの正規化は、この設問で問う条件を満たさない。,正解。,Dは不適切。画像の解像度だけは、この設問で問う条件を満たさない。,分類の正誤と確率の信頼性を混同するのがひっかけ。,さいはての未来では、便利な共鳴世界ほど観測・検証・責任の線引きが必要になる、と戻して覚える。,キャリブレーション;確率出力;信頼度;分類モデル;評価
G3000-R42-034,Rebuild_Set42,rebuild,case,AI事業者/主体別責任,ガバナンス判断,複合ケース,高,高,AIサービスでは、開発者、提供者、利用者がそれぞれ異なる役割を持つ。利用者側に特に求められる対応として最も適切なものはどれか。,開発者がいるので利用者側の管理は不要である,利用者は出力を無条件に正しいものとして扱う,自社の利用目的・入力データ・人間確認・利用ルールを管理する,提供者の規約を読まなくても業務利用してよい,C,AIの安全利用では、開発者・提供者だけでなく、利用者も用途、入力、確認、社内ルールを管理する必要がある。,Aは不適切。開発者がいるので利用者側の管理は不要であるは、この設問で問う条件を満たさない。,Bは不適切。利用者は出力を無条件に正しいものとして扱うは、この設問で問う条件を満たさない。,正解。,Dは不適切。提供者の規約を読まなくても業務利用してよいは、この設問で問う条件を満たさない。,責任をすべて開発者に押し付ける選択肢がひっかけ。,さいはての未来では、便利な共鳴世界ほど観測・検証・責任の線引きが必要になる、と戻して覚える。,AIガバナンス;AI事業者ガイドライン;利用者責任;開発者;提供者
G3000-R42-035,Rebuild_Set42,rebuild,case,データシフト/外部妥当性,評価設計,複合ケース,中,高,都市部のデータで学習した交通需要予測モデルを地方で使ったところ精度が低い。主な原因候補として最も適切なものはどれか。,モデルを保存したファイル名が短いこと,分類ではなく回帰だから評価できないこと,学習時と利用時のデータ分布や行動パターンが異なること,データが多ければ地域差は必ず消えること,C,学習時と利用時の分布が異なると性能が落ちる。外部妥当性や分布シフトの確認が必要である。,Aは不適切。モデルを保存したファイル名が短いことは、この設問で問う条件を満たさない。,Bは不適切。分類ではなく回帰だから評価できないことは、この設問で問う条件を満たさない。,正解。,Dは不適切。データが多ければ地域差は必ず消えることは、この設問で問う条件を満たさない。,一地域の評価を全地域にそのまま一般化するのがひっかけ。,さいはての未来では、便利な共鳴世界ほど観測・検証・責任の線引きが必要になる、と戻して覚える。,データシフト;外部妥当性;交通需要予測;分布変化;地域差
G3000-R42-036,Rebuild_Set42,rebuild,case,AI倫理/ダークパターン,倫理判断,複合ケース,高,高,生成AIチャットが、ユーザーを長時間利用させるために不安をあおる返答を優先する設計になっている。倫理上の問題として最も適切なものはどれか。,出力文字数が多いので常に高品質である,AIが会話するだけなら倫理問題は起きない,利用者の自律性や福祉を損なう操作的設計になっている可能性,利用時間が伸びれば社会的に常に望ましい,C,AI設計では、利用者の自律性、心理的安全、過度な誘導を避けることが重要である。,Aは不適切。出力文字数が多いので常に高品質であるは、この設問で問う条件を満たさない。,Bは不適切。AIが会話するだけなら倫理問題は起きないは、この設問で問う条件を満たさない。,正解。,Dは不適切。利用時間が伸びれば社会的に常に望ましいは、この設問で問う条件を満たさない。,エンゲージメントだけを成功指標にするのがひっかけ。,さいはての未来では、便利な共鳴世界ほど観測・検証・責任の線引きが必要になる、と戻して覚える。,AI倫理;ダークパターン;利用者自律性;生成AI;心理的安全
G3000-R42-037,Rebuild_Set42,rebuild,case,特徴量重要度/因果誤解,読解判断,複合ケース,中,高,モデルの特徴量重要度で『年収』が高く出た。これを解釈する際の注意として最も適切なものはどれか。,重要度が高い特徴量は必ず原因である,重要度が低い特徴量は法律上必ず使ってよい,重要度は予測への寄与を示すが、それだけで因果関係とは断定できない,特徴量重要度があれば公平性評価は不要になる,C,特徴量重要度はモデルの予測への寄与を示すものであり、因果効果や倫理的妥当性を自動的に保証しない。,Aは不適切。重要度が高い特徴量は必ず原因であるは、この設問で問う条件を満たさない。,Bは不適切。重要度が低い特徴量は法律上必ず使ってよいは、この設問で問う条件を満たさない。,正解。,Dは不適切。特徴量重要度があれば公平性評価は不要になるは、この設問で問う条件を満たさない。,説明可能性を因果証明と混同するのがひっかけ。,さいはての未来では、便利な共鳴世界ほど観測・検証・責任の線引きが必要になる、と戻して覚える。,特徴量重要度;XAI;因果関係;公平性;モデル解釈
