id,set,phase,question_type,topic,cognition_axis,format_axis,recency_axis,trickiness_axis,question,A,B,C,D,answer,explanation,wrong_A,wrong_B,wrong_C,wrong_D,trap_point,story_hint,search_keywords
G3000-R14-027,Rebuild_Set14,rebuild_50,term,スケーリング,理解,用語説明,安定,中,特徴量のスケーリングが特に重要になりやすいモデルとして最も適切なのはどれか。,文字列検索だけを行うモデル,決定木だけで構成されるモデルは常にすべて同じ影響を受ける,距離や勾配の大きさの影響を受けやすいモデル,ルールベースで固定条件だけを見るシステム,C,k近傍法、SVM、ニューラルネットワークなどでは特徴量の尺度が学習や距離計算に影響しやすい。,固定ルールだけなら学習モデルのスケーリングとは別。,文字列検索の話ではない。,木系モデルはスケールの影響を受けにくい場合が多い。,正しい。,すべてのモデルで同じ重要度ではない点がひっかけ。,身長cmと年収円を同じものさしで比べたら、円が大声を出しすぎる。,スケーリング;標準化;正規化;k近傍法;SVM
G3000-R14-028,Rebuild_Set14,rebuild_50,compare,標準化と正規化,理解,比較,安定,中,平均0・分散1へそろえる処理と、0〜1などの範囲へ収める処理の組み合わせとして最も適切なのはどれか。,どちらも目的変数を削除する処理である,標準化は著作権処理、正規化は個人情報削除である,標準化は平均0・分散1などに変換し、正規化は一定範囲へ収める処理を指すことが多い,どちらもモデルの層数を増やす処理である,C,標準化は平均と標準偏差を使う変換、正規化は0〜1など範囲をそろえる変換を指すことが多い。,ネットワーク構造変更ではない。,目的変数削除ではない。,法律・プライバシー処理ではない。,正しい。,日本語では正規化が広く使われる場合もあるため、文脈を見る。,声の大きさをそろえる方法にも、平均との差を見る方法と範囲に収める方法がある。,標準化;正規化;スケーリング;平均0分散1;Min-Max
G3000-R14-029,Rebuild_Set14,rebuild_50,case,学習済み前処理,判断,ケース判断,安定,高,標準化の平均と標準偏差を、訓練データではなくテストデータ全体から計算してしまった。何が問題になりやすいか。,分類問題が自動的に回帰問題になる,モデルが必ず学習不能になる,テストデータの情報が前処理に混入し、評価が甘くなる可能性がある,説明変数がすべてカテゴリ変数になる,C,前処理の統計量も訓練データから学習し、検証・テストへ適用するのが基本。テスト情報を使うとリーケージになりうる。,変数型が変わるとは限らない。,タスク種類が変わるわけではない。,学習不能とまでは限らない。,正しい。,モデルだけでなく前処理のfitにもリーケージが起きる。,模試の答え分布を見てから勉強法を変えると、本番力を測れない。,標準化;データリーケージ;前処理;fit_transform;テストデータ
G3000-R14-030,Rebuild_Set14,rebuild_50,term,不確実性推定,理解,用語説明,安定,高,AIの予測における不確実性推定の目的として最も適切なのはどれか。,画像サイズを必ず半分にする,モデルの重みを必ず0にする,予測値だけでなく、その予測がどの程度確からしいかの情報を扱う,個人情報を自動で公開する,C,不確実性推定は、予測に対する信頼度やばらつきを把握し、人間確認やリスク判断に役立てる。,プライバシー侵害であり目的ではない。,画像圧縮の話ではない。,重み削除ではない。,正しい。,確率出力が常に校正済みの信頼度とは限らない点も注意。,ミチが答えるだけでなく「ここは自信が低い」と言えれば、ユイは確認しやすい。,不確実性推定;信頼度;校正;キャリブレーション;人間確認
G3000-R14-031,Rebuild_Set14,rebuild_50,term,キャリブレーション,理解,用語説明,安定,高,分類モデルのキャリブレーションが良い状態として最も適切なのはどれか。,すべての予測を50%にする,訓練データで正解率100%になる,予測確率70%と出したサンプル群が、実際におおむね70%程度正解している,不正解データだけを削除する,C,キャリブレーションは、モデルが出す予測確率と実際の正解頻度が対応しているかを見る考え方である。,評価をゆがめる。,常に50%では有用な確率ではない。,過学習の可能性がある。,正しい。,高精度と確率の校正は別概念。,「七割くらい」と言ったら、本当に十回中七回くらい当たるのがよい。,キャリブレーション;予測確率;信頼度;分類モデル;不確実性
G3000-R14-032,Rebuild_Set14,rebuild_50,case,しきい値調整,判断,ケース判断,安定,中,不正取引検知で、疑わしい取引を人間が確認する。確認担当者の負荷が大きすぎるため、見逃し増加を許容しつつ通知件数を減らしたい。直接調整しやすいものはどれか。,モデルの説明文のフォント,訓練データのファイル名,分類のしきい値,データベースの色設定,C,分類確率のしきい値を変えると、検知件数、適合率、再現率のバランスを調整できる。,色設定では分類結果は変わらない。,表示の見た目で性能は変わらない。,ファイル名変更では通知件数は本質的に変わらない。,正しい。,モデル再学習だけでなく、運用上のしきい値調整も選択肢になる。,警報ベルを鳴らす高さを変える。低すぎると鳴りすぎ、高すぎると見逃す。,しきい値;適合率;再現率;不正検知;運用
G3000-R14-033,Rebuild_Set14,rebuild_50,compare,PR曲線,理解,比較,安定,中,陽性が少ない不均衡データで、陽性検出の性能を見たい。ROC曲線に加えて特に確認されることが多いものはどれか。,IoUだけ,BLEUスコアだけ,PR曲線,Perplexityだけ,C,PR曲線は適合率と再現率の関係を表し、陽性が少ない不均衡データで有用なことがある。,言語モデルの予測しやすさの指標。,物体検出などで使われる領域重なり指標。,翻訳など生成文評価で使われる指標。,正しい。,ROCだけでなく、陽性クラスに注目するPR曲線が問われる。,珍しい黒を見つけるなら、見つけた数と空振りを同時に見る。,PR曲線;適合率;再現率;不均衡データ;ROC曲線
G3000-R14-034,Rebuild_Set14,rebuild_50,term,しきい値非依存指標,理解,用語説明,安定,高,ROC曲線の下面積を使って分類モデルの順位付け性能を見る指標はどれか。,画像の横幅だけを表す値,学習率そのものを表す単位,分類しきい値を変えたときの曲線下面積などで、ランキング性能を評価する指標として使われる,データの個人識別性を完全に消す値,C,AUCはROC曲線などの下面積として使われ、しきい値に依存しない評価指標の一つである。,匿名化の程度を直接表す一般指標ではない。,画像サイズではない。,学習率ではない。,正しい。,AUCが高くても、運用しきい値での適合率・再現率確認は必要。,全体の坂道のよさと、実際にどの高さで門を開けるかは別。,AUC;ROC;しきい値;分類評価;ランキング性能
G3000-R14-035,Rebuild_Set14,rebuild_50,case,ランキング評価,判断,ケース判断,安定,高,検索結果の上位に関連文書がどれだけ含まれるかを評価したい。最も近い観点はどれか。,音声のサンプリング周波数固定,画像の色空間変換,ランキング評価,全結合層のユニット数だけ,C,検索や推薦では、上位に良い候補が並ぶかというランキング評価が重要になる。,モデル構造の一部であり評価観点ではない。,音声処理の話。,画像前処理の話。,正しい。,単なる正解率では順位の良し悪しを測りにくい。,棚のどこかに正解があるだけでなく、手前に置いてあるかが大事。,ランキング評価;検索;推薦;Precision@k;NDCG
G3000-R14-036,Rebuild_Set14,rebuild_50,term,Precision@k,理解,用語説明,安定,高,検索上位10件のうち関連文書が何件あるかを見たい。この考えに最も近い指標はどれか。,k近傍法の距離関数そのもの,k分割交差検証で必ず使う損失関数,上位k件の推薦や検索結果のうち、関連するものの割合,画像をk色に減色する処理,C,Precision@kは、ランキング上位k件に含まれる関連アイテムの割合を見る指標である。,画像処理の色数削減ではない。,k近傍法のkとは別。,交差検証の損失関数ではない。,正しい。,kという文字だけでk近傍法やk分割と混同しやすい。,上から5枚めくって、当たりが何枚あるか。,Precision@k;ランキング評価;推薦;検索;上位k件
G3000-R14-037,Rebuild_Set14,rebuild_50,term,NDCG,理解,用語説明,安定,高,NDCGが評価しようとするものとして最も適切なのはどれか。,カテゴリ変数を必ず削除する,ニューラルネットワークの勾配を必ず消す,関連度の高い結果が上位に並んでいるかを、順位を考慮して評価する,音声を必ず画像へ変換する,C,NDCGは検索・推薦などで、関連度と順位を考慮したランキング評価指標として使われる。,音声画像変換ではない。,カテゴリ変数削除ではない。,勾配消失とは無関係。,正しい。,関連するかどうかだけでなく、どの順位に出るかを見る。,大事な手紙が一番上にあるか、箱の底に埋もれているか。,NDCG;ランキング評価;推薦;検索;関連度
G3000-R14-038,Rebuild_Set14,rebuild_50,case,推薦の多様性,判断,ケース判断,安定,中,推薦システムで、ユーザーが似た商品ばかり見せられて新しい発見が減っている。精度以外に改善したい観点として最も近いものはどれか。,画像の赤成分だけ,訓練データの行番号,推薦の多様性やセレンディピティ,音声の無音区間だけ,C,推薦では精度だけでなく、多様性、新規性、セレンディピティなども重要になる。,音声処理の話ではない。,画像色成分の話ではない。,行番号は本質的な改善観点ではない。,正しい。,当たりやすい推薦だけが良い推薦とは限らない。,いつも同じ温泉まんじゅうだけでなく、別の道も見せる。,推薦;多様性;セレンディピティ;フィルターバブル;ランキング
G3000-R14-039,Rebuild_Set14,rebuild_50,term,コールドスタート再訪,理解,用語説明,安定,低,新規ユーザーや新規商品に対して推薦が難しい問題として最も適切なのはどれか。,画像のプーリング,勾配爆発,過剰適合だけ,コールドスタート問題,D,コールドスタート問題は、履歴や評価が少ない新規ユーザー・新規アイテムに対して推薦が難しい問題である。,正しい。,過学習とは別の推薦特有の問題。,CNNの処理。,RNNなどで勾配が大きくなる問題。,推薦の文脈で出る頻出用語。既出でも今回は新規ユーザー・新規商品に限定した問われ方。,初対面の子に何をすすめるかは、まだ手がかりが少ない。,コールドスタート;推薦;新規ユーザー;新規アイテム;協調フィルタリング
G3000-R14-040,Rebuild_Set14,rebuild_50,case,探索と活用,判断,ケース判断,安定,中,推薦で、ユーザーが好きそうな定番商品ばかり出すと短期クリックは高いが、好みの発見が進まない。新しい候補も試す考え方に近いものはどれか。,損失関数を使わない学習,データの完全削除だけ,画像の二値化だけ,探索と活用のトレードオフ,D,推薦やバンディット問題では、既に良さそうな選択肢を使う活用と、新しい選択肢を試す探索のバランスが重要。,正しい。,画像前処理の話ではない。,学習では通常、目的や評価が必要。,削除の話ではない。,強化学習だけでなく推薦にも出る考え方。,安全な道だけ歩くと、まだ見ぬ佐々江温泉にたどり着けない。,探索と活用;推薦;バンディット;セレンディピティ;トレードオフ
G3000-R14-041,Rebuild_Set14,rebuild_50,term,多腕バンディット,理解,用語説明,安定,高,広告や推薦で、複数候補を試しながら報酬の高い選択肢を選ぶ基本問題はどれか。,個人情報をすべて公開する問題,画像の物体を矩形で囲む問題だけ,文章の文法誤りを必ず訂正する問題,複数の選択肢から、報酬を観測しながらどれを選ぶか学習する問題,D,多腕バンディットは、選択肢ごとの報酬が不確かな中で、試行を通じて選択方針を学ぶ問題である。,正しい。,文法訂正に限定されない。,プライバシー侵害であり目的ではない。,物体検出の話ではない。,強化学習に似るが状態遷移を伴う一般的なMDPより単純な設定として問われる。,どのくじ箱を引くか、試しながら当たりやすさを学ぶ。,多腕バンディット;探索活用;報酬;推薦;A/Bテスト
G3000-R14-042,Rebuild_Set14,rebuild_50,case,A/Bテスト,判断,ケース判断,安定,中,Webサービスで推薦アルゴリズムAとBを一部ユーザーに分けて提示し、クリック率や継続率を比較したい。最も近い方法はどれか。,音声合成,主成分分析,画像セグメンテーション,A/Bテスト,D,A/Bテストは、異なる施策をグループに提示して、実際の指標差を比較する実験方法である。,正しい。,画像の領域分割。,音声生成。,次元削減手法。,オフライン評価だけでなく、実サービス上の実験評価が問われる。,二つの道を少しずつ歩いて、どちらが町に合うか見る。,A/Bテスト;オンライン評価;クリック率;推薦;実験設計
G3000-R14-043,Rebuild_Set14,rebuild_50,term,反実仮想,理解,用語説明,安定,高,反実仮想の考え方として最も近いものはどれか。,テストデータを訓練に混ぜること,画像を左右反転してデータを増やすことだけ,モデルの重みをすべて固定すること,実際には行わなかった別の施策を行っていたら結果がどうなったかを考える,D,反実仮想は、実際とは異なる条件や介入があった場合の結果を考える因果推論の重要な考え方である。,正しい。,転移学習などの一部操作。,データリーケージ。,データ拡張の一例。,単なる相関ではなく、もし別の介入をしたらという問い。,もしユイがその文を消していたら、物語はどう変わったか。,反実仮想;因果推論;介入;効果検証;相関と因果
G3000-R14-044,Rebuild_Set14,rebuild_50,compare,相関と因果,理解,比較,安定,中,「一緒に増減する」ことと「一方が他方を引き起こす」ことの関係として最も適切なのはどれか。,相関係数は画像分類の損失関数でしか使えない,相関があれば必ず因果関係がある,因果関係はデータ分析では一切扱えない,相関があるだけでは、一方が他方を引き起こしたとは限らない,D,相関は一緒に変動する関係を示すが、因果を主張するには交絡や介入などを考慮する必要がある。,正しい。,因果推論として扱う方法がある。,相関係数はさまざまな分析で使われる。,交絡や逆因果の可能性がある。,G検定では、AIの予測が因果を説明するとは限らない点が狙われる。,雨の日に傘が増えても、傘が雨を降らせたわけではない。,相関;因果;因果推論;交絡;介入
G3000-R14-045,Rebuild_Set14,rebuild_50,case,交絡,判断,ケース判断,安定,高,アイスの売上と熱中症患者数に相関があった。実際には気温が両方に影響している可能性がある。この気温のような要因は何と呼ばれるか。,ドロップアウト率,活性化関数,目的変数だけ,交絡因子,D,交絡因子は、原因候補と結果の両方に関係し、見かけの関連を生む要因である。,正則化手法の割合。,ニューラルネットワークの非線形変換。,予測対象だけを指すわけではない。,正しい。,相関を見ただけで因果と判断しないための代表例。,暑さという見えない手が、アイスと熱中症の両方を動かす。,交絡因子;因果推論;相関;気温;効果検証
G3000-R14-046,Rebuild_Set14,rebuild_50,term,傾向スコア,理解,用語説明,安定,高,処置群と非処置群を比べる前に、「処置を受けそうだった確率」をそろえるために使われる考え方はどれか。,LLMの語彙サイズそのもの,モデルの学習率を自動で0にする値,画像の明るさを必ず一定にする値,ある対象が処置を受ける確率を、観測された共変量から推定したもの,D,傾向スコアは、観測された特徴から処置群に入る確率を推定し、群間比較の偏りを調整するために使われる。,正しい。,画像補正ではない。,語彙サイズではない。,学習率ではない。,因果推論の用語であり、分類の予測確率一般とは文脈が違う。,同じくらい処置を受けそうだった人どうしを比べるための下ごしらえ。,傾向スコア;因果推論;処置効果;共変量;マッチング
G3000-R14-047,Rebuild_Set14,rebuild_50,case,オンライン学習,判断,ケース判断,安定,中,データが逐次到着し、モデルを少しずつ更新したい。ただし誤った新データで性能が崩れないよう監視も必要である。この考え方に近いものはどれか。,文書の著作権表示だけ,完全な一括削除,画像の固定リサイズだけ,オンライン学習,D,オンライン学習はデータが到着するたび、または小単位でモデルを更新する学習方法である。運用ではデータ品質監視も重要。,正しい。,画像前処理だけではない。,法的表示の話ではない。,学習更新の説明ではない。,常に良いとは限らず、ドリフトや汚染データに注意する。,毎日少しずつ学ぶ子は、変な噂も覚えないよう先生が見る必要がある。,オンライン学習;逐次学習;データ品質;モデル更新;ドリフト
G3000-R14-048,Rebuild_Set14,rebuild_50,compare,バッチ学習とオンライン学習,理解,比較,安定,中,一度まとめて学習する方式と、到着データで逐次更新する方式の対応として最も適切なのはどれか。,両者はデータ分割の禁止を意味する,バッチ学習は教師なし学習、オンライン学習は必ず教師あり学習である,バッチ学習は画像専用、オンライン学習は音声専用である,バッチ学習はまとまったデータで学習し、オンライン学習は逐次的に更新する,D,バッチ学習はまとまったデータセットで学習し、オンライン学習は新しいデータに応じて逐次更新する。,正しい。,データ種類に限定されない。,分割禁止ではない。,教師あり/なしの区別とは別軸。,バッチサイズのバッチと、学習方式としてのバッチ学習を混同しない。,一冊まとめて勉強するか、毎日届く手紙で少しずつ学ぶか。,バッチ学習;オンライン学習;逐次学習;モデル更新;学習方式
G3000-R14-049,Rebuild_Set14,rebuild_50,case,データスキーマ監視,判断,ケース判断,安定,中,本番推論で、ある日から「年齢」列が文字列で届くようになり、モデルがエラーを出した。監視すべき対象として最も直接的なのはどれか。,学習済みモデルのファイル名の長さ,画像の色名だけ,モデルの論文引用数,入力データのスキーマや型,D,本番運用では、入力列名、型、範囲、欠損率などデータスキーマの変化を監視する必要がある。,正しい。,引用数は運用エラー検知ではない。,ファイル名長は本質ではない。,画像色名だけでは列型エラーを検出できない。,精度監視だけでなく、入力形式の監視も重要。,入口の扉の形が変わったら、中の機械はうまく動かない。,データスキーマ;型監視;MLOps;本番推論;データ品質
G3000-R14-050,Rebuild_Set14,rebuild_50,term,特徴量ストア,理解,用語説明,安定,高,学習時と推論時で同じ特徴量定義を使うため、特徴量を管理・提供する基盤はどれか。,画像のノイズを必ずゼロにする仕組み,著作権を自動的に消滅させる仕組み,LLMの出力を必ず真実にする仕組み,学習・推論で使う特徴量を一元管理し、再利用性や一貫性を高める仕組み,D,特徴量ストアは、特徴量の定義・生成・提供を管理し、学習時と推論時のずれを減らすために使われる。,正しい。,ハルシネーションを完全に防ぐものではない。,ノイズ除去専用ではない。,著作権処理ではない。,便利な運用基盤だが、特徴量定義の品質管理が前提。,よく使う材料を同じ棚で管理すれば、料理ごとの味のズレが減る。,特徴量ストア;Feature Store;MLOps;特徴量管理;学習推論一貫性
