id,set,phase,question_type,topic,cognition_axis,format_axis,recency_axis,trickiness_axis,question,A,B,C,D,answer,explanation,wrong_A,wrong_B,wrong_C,wrong_D,trap_point,story_hint,search_keywords
G3000-R14-001,Rebuild_Set14,rebuild_50,case,時系列予測,判断,ケース判断,安定,中,月次売上を予測するAIを作る。過去12か月の売上から翌月売上を予測したい場合、最も注意すべきデータ分割はどれか。,過去期間で学習し、未来期間で評価する,全データをランダムに訓練・テストへ混ぜる,売上が高い月だけをテストにする,最新月の売上を特徴量として同じ月を予測する,A,時系列予測では未来情報が学習側に混入しないよう、時間順を保って過去で学習し未来で評価する。,正しい。時系列分割の基本。,ランダム分割は未来情報の混入につながりやすい。,評価が偏り、汎化性能を測りにくい。,目的変数に近い情報を使うリーケージになりやすい。,通常の分類問題の感覚でランダム分割を選ばせるひっかけ。,ユイが未来の日記を見て昨日の判断を当てるのは、実力ではなく反則。,時系列予測;時系列分割;データリーケージ;未来情報;需要予測
G3000-R14-002,Rebuild_Set14,rebuild_50,term,自己回帰モデル,理解,用語説明,安定,中,ARモデルを使う場面として最も自然なのはどれか。,過去の値を使って現在または将来の値を予測するモデル,入力データを乱数だけで置き換えるモデル,クラス間の境界を最大化する分類モデル,画像の局所特徴を畳み込むモデル,A,自己回帰は、系列データにおいて過去の値が現在や未来の値に影響するという考えを使う。,正しい。過去の系列値を説明変数として使う。,ノイズ注入や生成過程の一部とは異なる。,SVMの説明に近い。,CNNの畳み込みの説明。,「自己」という語から教師なし学習と混同しやすい。,ミチが直前の言葉の流れを見て次を出すように、過去値が手がかりになる。,自己回帰;ARモデル;時系列;系列データ;予測
G3000-R14-003,Rebuild_Set14,rebuild_50,compare,移動平均,理解,比較,安定,中,時系列データの移動平均を使う目的として最も適切なものはどれか。,短期的なばらつきをならし、傾向を見やすくするため,カテゴリ変数を整数に変換するため,データの次元を必ず1次元増やすため,モデルの重みをランダムに初期化するため,A,移動平均は一定期間の平均を順に計算し、ノイズをならしてトレンドを見やすくする。,正しい。平滑化の基本。,エンコーディングの説明。,次元を増やす操作ではない。,ニューラルネットワークの初期化の説明。,平均という語だけで評価指標の平均と混同しない。,四年五組で毎日の騒がしさを見るより、数日分ならすと町の変化が見えやすい。,移動平均;平滑化;トレンド;ノイズ;時系列
G3000-R14-004,Rebuild_Set14,rebuild_50,case,季節性,判断,ケース判断,安定,中,毎年12月に売上が上がり、2月に下がる小売データがある。この特徴を表す用語として最も適切なものはどれか。,季節性,過学習,勾配消失,外れ値,A,一定周期で繰り返される変動は季節性と呼ばれる。月次・曜日・時間帯の周期も対象になる。,正しい。周期的な売上変動は季節性。,学習データへの過剰適合ではない。,深いネットワークで勾配が小さくなる問題。,外れ値は他と大きく異なる単発的な値。,12月だけを異常値と見るか、毎年繰り返す周期と見るかが分かれ目。,毎年同じ時期に通知魚が増えるなら、異常ではなく季節の呼吸。,季節性;周期性;時系列;需要予測;曜日効果
G3000-R14-005,Rebuild_Set14,rebuild_50,term,トレンド,理解,用語説明,安定,低,時系列データにおけるトレンドの説明として最も適切なものはどれか。,長期的な増加・減少などの傾向,単語をベクトルへ変換する処理,分類モデルのしきい値,ニューラルネットワークの層数,A,トレンドは時系列データにおける長期的な方向性を表す。,単語埋め込みの説明。,分類の判定境界や閾値の話。,モデル構造の深さの話。,正しい。,短期のノイズと長期傾向を混同しない。,ユイの忙しさが一日だけでなく年々増えているなら、それはトレンド。,トレンド;時系列;傾向;長期変動;需要予測
G3000-R14-006,Rebuild_Set14,rebuild_50,case,概念ドリフト,判断,ケース判断,安定,中,数年前に作った需要予測モデルが、コロナ禍後の購買行動変化で急に当たらなくなった。この現象に最も近いものはどれか。,概念ドリフト,データ拡張,ワンホットエンコーディング,ラベル平滑化,A,概念ドリフトは、時間とともに入力と正解の関係やデータ分布が変化し、モデル性能が低下する現象である。,正しい。環境変化による関係性の変化。,データを増やすための加工。,カテゴリ変数の表現方法。,正解ラベルを少し滑らかにする正則化的手法。,単なるデータ不足ではなく、世界側の関係が変わった点を問う。,共鳴世界の規則が変われば、昨日の地図は今日の道を示さない。,概念ドリフト;データドリフト;モデル劣化;再学習;MLOps
G3000-R14-007,Rebuild_Set14,rebuild_50,compare,データドリフト,理解,比較,安定,中,本番で入力される顧客属性の分布が学習時とずれてきた。監視対象として最も近いものはどれか。,入力データの分布が学習時から変化すること,損失関数が必ず0になること,テストデータを訓練に混ぜること,モデルの層を増やして表現力を上げること,A,データドリフトは、本番環境で入力データの分布が学習時と変わることを指す。,損失が0になる保証はない。,これはデータリーケージ。,モデル容量を増やす話。,正しい。,概念ドリフトは関係性の変化、データドリフトは入力分布の変化として区別する。,町に来る人の種類が変わるのがデータドリフト、町のルールが変わるのが概念ドリフト。,データドリフト;分布変化;概念ドリフト;監視;本番運用
G3000-R14-008,Rebuild_Set14,rebuild_50,term,ウォークフォワード検証,理解,用語説明,安定,高,時系列モデルの評価で、学習期間を前に進めながら未来期間を順に評価する方法に最も近いものはどれか。,ウォークフォワード検証,ランダムサンプリング,層化k分割交差検証,ブートストラップで目的変数を消す方法,A,ウォークフォワード検証は、時間順を保ちながら学習窓と評価窓を進めて、時系列予測を評価する考え方である。,正しい。時間を前に進めて評価する。,時系列では未来混入の危険がある。,分類の割合維持には有効だが、時系列の順序を壊すことがある。,目的変数を消す評価法ではない。,交差検証という語だけで通常のk分割を選ばせる。,未来の扉を一枚ずつ開けて検証する。まとめて全部見てはいけない。,ウォークフォワード検証;時系列検証;バックテスト;時系列分割;需要予測
G3000-R14-009,Rebuild_Set14,rebuild_50,case,バックテスト,判断,ケース判断,安定,中,金融の売買戦略AIについて、過去データ上でどの程度利益が出たかを検証したい。この検証に最も近い用語はどれか。,バックテスト,蒸留,トークナイズ,画像セグメンテーション,A,バックテストは過去データを用いて戦略や予測手法の有効性を検証する方法で、金融でよく使われる。,正しい。過去データで戦略を検証する。,大きなモデルの知識を小さなモデルへ移す手法。,テキストを単位に分ける処理。,画像を領域ごとに分類するタスク。,過去で良かった戦略が未来でも良いとは限らない点も重要。,過去の戦いで勝った剣でも、次の敵に必ず勝てるとは限らない。,バックテスト;金融AI;時系列;リーケージ;過学習
G3000-R14-010,Rebuild_Set14,rebuild_50,term,グラフ構造,理解,用語説明,安定,低,ノードとエッジで関係を表すデータ構造として最も適切なものはどれか。,グラフ構造,決定木の葉だけ,ヒストグラム,ミニバッチ,A,グラフ構造は対象をノード、関係をエッジとして表す。SNS、交通網、分子構造などに使える。,正しい。ノードとエッジの関係表現。,決定木の末端ノードだけでは関係全体を表せない。,値の分布を棒で表す図。,学習時のデータの小分け単位。,グラフは棒グラフの意味だけではない。データ構造としてのグラフを問う。,人物相関図は、名前がノード、関係がエッジ。,グラフ構造;ノード;エッジ;関係データ;ネットワーク分析
G3000-R14-011,Rebuild_Set14,rebuild_50,term,GNN,理解,用語説明,安定,中,グラフニューラルネットワーク（GNN）の説明として最も適切なものはどれか。,ノードやエッジの関係構造を利用して学習するニューラルネットワーク,表データの欠損値を必ず0で埋める手順,画像だけを1ピクセルずつ並べ替えるモデル,音声波形を必ず文字に変換するルール,A,GNNはグラフの隣接関係やノード特徴量を使い、関係構造を含むデータを学習する。,正しい。関係構造を学習する。,欠損値処理の固定手順ではない。,画像専用の並べ替えモデルではない。,音声認識の固定ルールではない。,ニューラルネットワークと付くが、画像CNNだけを想定しない。,通知魚どうしのつながりを見て、群れ全体の意味を読む。,GNN;グラフニューラルネットワーク;ノード分類;リンク予測;メッセージパッシング
G3000-R14-012,Rebuild_Set14,rebuild_50,case,リンク予測,判断,ケース判断,安定,中,SNS上で、まだつながっていない2人が将来友人になる可能性を予測したい。このタスクに最も近いものはどれか。,リンク予測,感情分析,物体検出,音声合成,A,リンク予測はグラフ上でノード間に将来エッジが生じるか、未観測の関係があるかを予測するタスクである。,正しい。関係の有無を予測する。,文章の感情極性を推定するタスク。,画像内の物体位置と種類を検出するタスク。,テキストなどから音声を生成するタスク。,「推薦」と近い文脈でも、グラフ上の辺を予測するならリンク予測。,まだ線のない人物相関図に、次に線が引かれる場所を読む。,リンク予測;グラフ;SNS;推薦;GNN
G3000-R14-013,Rebuild_Set14,rebuild_50,term,ノード分類,理解,用語説明,安定,中,グラフ上の各ノードにカテゴリを割り当てるタスクとして最も適切なものはどれか。,ノード分類,データ拡張,勾配クリッピング,確率的勾配降下法,A,ノード分類は、グラフ上のノードそれぞれにラベルを付けるタスクである。論文分類やユーザー属性推定などが例。,正しい。ノードごとのラベル推定。,学習データを加工して増やす方法。,勾配が大きくなりすぎるのを抑える方法。,最適化手法。,リンク予測は辺、ノード分類は点を予測する。,点に名札をつけるのがノード分類、点と点を結ぶ線を読むのがリンク予測。,ノード分類;グラフ;GNN;ノード;ラベル
G3000-R14-014,Rebuild_Set14,rebuild_50,compare,メッセージパッシング,理解,比較,安定,高,GNNにおけるメッセージパッシングの説明として最も適切なものはどれか。,テストデータを本番後に削除する運用,各ノードが隣接ノードの情報を集約し、自身の表現を更新する仕組み,画像を必ず白黒に変換する処理,文章を句読点だけで分割する処理,B,メッセージパッシングでは、近傍ノードから情報を受け取り集約してノード表現を更新する。,前処理の一例でありGNN固有ではない。,評価データ管理の話。,簡易なトークン分割でありGNNの説明ではない。,正しい。,メッセージという語からメール送信機能と誤解しない。,カサネが隣の子の見たものを受け取り、自分の見方を少し変える。,メッセージパッシング;GNN;近傍集約;ノード表現;グラフ
G3000-R14-015,Rebuild_Set14,rebuild_50,case,分子グラフ,判断,ケース判断,安定,中,化合物の原子をノード、結合をエッジとして表し、性質を予測したい。最も相性がよい考え方はどれか。,文字列のBag-of-Wordsだけを使う分類,グラフ構造を利用した学習,画像セグメンテーションだけで解く,音声認識モデルだけを使う,B,分子は原子と結合の関係を持つため、グラフとして表現しGNNなどで学習する発想が有効。,画像の領域分割だけでは分子構造の関係を直接扱いにくい。,化学構造の関係を十分に表しにくい。,音声データ向けのモデルではない。,正しい。,対象が画像で見える構造式でも、本質は原子間関係。,さいはての未来の相関図と同じで、点と線に意味が宿る。,分子グラフ;GNN;ノード;エッジ;化合物予測
G3000-R14-016,Rebuild_Set14,rebuild_50,term,表データ,理解,用語説明,安定,低,表データを扱う機械学習で一般に重要となる観点として最も適切なものはどれか。,画像の畳み込みだけを必ず使う,列ごとの意味、欠損値、カテゴリ変数、スケールなどを確認する,入力文を必ずTransformerで処理する,音声波形に必ずメルスペクトログラムを使う,B,表データでは特徴量の意味、欠損値、カテゴリ変数、スケーリング、リーケージ確認などが重要。,テキスト向けモデルに限定する必要はない。,画像向けの手法に限定する必要はない。,音声処理の話。,正しい。,ディープラーニングが万能でも、表データでは前処理と特徴理解が重要。,列名はただの箱ではなく、観測された世界の切り口。,表データ;特徴量;欠損値;カテゴリ変数;スケーリング
G3000-R14-017,Rebuild_Set14,rebuild_50,case,カテゴリエンコーディング,判断,ケース判断,安定,中,「都道府県」列をモデルに入力したい。数値の大小関係を勝手に持たせたくない場合、基本的な方法として適切なのはどれか。,都道府県名を五十音順の整数にしてそのまま距離として扱う,ワンホットエンコーディングなどでカテゴリとして表す,目的変数を都道府県名に置き換える,テストデータだけから都道府県一覧を作る,B,名義カテゴリには大小関係がないため、ワンホットエンコーディングなどでカテゴリとして扱うのが基本。,整数化だけだと不要な順序関係を持ち込むことがある。,目的変数の置き換えではない。,テスト情報だけに依存する設計は不適切。,正しい。,ラベルエンコーディングとワンホットの使い分けが狙われる。,番号札をつけても、1番が2番より小さいとは限らない。,ワンホットエンコーディング;カテゴリ変数;名義尺度;表データ;前処理
G3000-R14-018,Rebuild_Set14,rebuild_50,term,ターゲットエンコーディング,理解,用語説明,安定,高,ターゲットエンコーディングを使うときの注意として最も適切なものはどれか。,カテゴリ変数には一切使えない,目的変数の情報を使うため、学習・検証の分け方によってはリーケージに注意する,画像の畳み込み層の重みを固定する手法である,正解ラベルを完全に削除する手法である,B,ターゲットエンコーディングはカテゴリを目的変数の統計量で表すため、検証データや未来データの情報を混ぜない注意が必要。,CNNの転移学習の説明ではない。,カテゴリ変数に使われることがある。,目的変数を使うが削除する手法ではない。,正しい。,便利だが答えに近い情報を混ぜやすい。,未来の採点結果を見て名札を書き換えるのは、ズルに近い。,ターゲットエンコーディング;データリーケージ;カテゴリ変数;特徴量設計;交差検証
G3000-R14-019,Rebuild_Set14,rebuild_50,case,欠損値メカニズム,判断,ケース判断,安定,高,アンケートで高所得者ほど年収欄を空欄にしやすい。欠損が値そのものと関係している可能性を示す説明として最も適切なものはどれか。,欠損は完全にランダムであり、常に平均値補完で十分である,欠損が目的や値と関係する場合があり、欠損理由の確認が重要である,欠損行は必ずすべて削除すべきである,欠損値はモデル性能に必ず良い影響を与える,B,欠損は完全にランダムとは限らず、欠損理由自体が情報を持つ場合がある。,完全ランダムと決めつけるのは危険。,削除で偏りが強まることがある。,欠損が常に良いとはいえない。,正しい。,欠損をただの空欄ではなく、発生理由まで見る。,沈黙にも意味がある。答えない理由が、答えに近いこともある。,欠損値;MCAR;MAR;MNAR;欠損理由
G3000-R14-020,Rebuild_Set14,rebuild_50,term,外れ値処理,理解,用語説明,安定,中,売上データに通常の10倍の値が1件だけある。最初に取るべき姿勢として最も適切なのはどれか。,外れ値は必ず誤りなので、理由を見ずに削除する,外れ値は貴重な異常の兆候である場合もあり、業務文脈を確認して扱う,外れ値はニューラルネットワークでは一切影響しない,外れ値処理は分類問題では不要である,B,外れ値は入力ミスの場合もあれば、異常検知で重要な兆候の場合もある。業務上の意味を確認する必要がある。,正しい外れ値まで消す危険がある。,損失や学習に影響する場合がある。,分類でも特徴量に外れ値があれば影響しうる。,正しい。,外れ値=削除と短絡しない。,黒のしみを汚れとして消すか、現象の入口として見るか。,外れ値;異常検知;前処理;データ品質;業務文脈
G3000-R14-021,Rebuild_Set14,rebuild_50,term,AutoML,理解,用語説明,安定,中,AutoMLを導入しても人間側に残る役割として最も重要なものはどれか。,AIが法律上の責任を完全に負う仕組み,機械学習のモデル選択やハイパーパラメータ探索などを自動化する取り組み,教師データを不要にすることだけを意味する用語,画像を自動で著作物ではなくする技術,B,AutoMLは特徴量処理、モデル選択、ハイパーパラメータ探索など機械学習ワークフローの一部を自動化する。,教師なし化だけを意味しない。,責任主体の問題ではない。,著作権状態を変える技術ではない。,正しい。,自動化されても目的設定や評価設計は人間側に残る。,ミチが候補を出しても、どれを採用するかはユイの判断。,AutoML;モデル選択;ハイパーパラメータ探索;自動機械学習;特徴量
G3000-R14-022,Rebuild_Set14,rebuild_50,case,ハイパーパラメータ探索,判断,ケース判断,安定,中,ランダムフォレストの木の数や最大深さを複数試し、検証性能が良い組み合わせを選ぶ作業に最も近いものはどれか。,目的変数の削除,ハイパーパラメータ探索,個人情報の匿名加工,音声認識の後処理だけ,B,木の数や深さなど学習前に設定する値を試す作業はハイパーパラメータ探索である。,プライバシー加工の話ではない。,予測対象を消す作業ではない。,音声処理に限らない。,正しい。,パラメータとハイパーパラメータの違いが問われる。,鍋の火加減や時間を変えて、一番よい仕上がりを探す。,ハイパーパラメータ;ランダムフォレスト;グリッドサーチ;ランダムサーチ;検証データ
G3000-R14-023,Rebuild_Set14,rebuild_50,compare,グリッドサーチ,理解,比較,安定,低,ハイパーパラメータ候補を「深さ3/5/7、木の数100/300」のように全組み合わせで試す方法はどれか。,勾配を逆向きに伝播する方法,候補値の組み合わせを格子状に列挙して試す方法,画像から物体の位置を出す方法,個人データを復元不能にする契約条項,B,グリッドサーチは、あらかじめ定めた候補値の全組み合わせを試すハイパーパラメータ探索方法である。,誤差逆伝播法の説明。,正しい。,物体検出の説明。,契約や匿名化の話ではない。,グリッドは探索空間の候補組み合わせを意味する。,ます目を一つずつ歩いて最適な場所を探す。,グリッドサーチ;ハイパーパラメータ;モデル選択;検証;探索
G3000-R14-024,Rebuild_Set14,rebuild_50,compare,ランダムサーチ,理解,比較,安定,中,ランダムサーチがグリッドサーチと比べて有効になりうる理由として最も適切なものはどれか。,必ず全探索より正確な最適解を保証する,候補空間から無作為に試すことで、重要でない軸に全組み合わせを費やしにくい場合がある,教師データを完全に不要にする,モデルの説明可能性を必ず高める,B,ランダムサーチは候補を無作為に試すため、重要なパラメータが一部に限られる場合に効率的なことがある。,教師データの有無とは別。,最適解保証ではない。,説明可能性を直接保証しない。,正しい。,ランダム=雑ではなく、探索効率の工夫として問われる。,全部の教室を順番に見るより、重要そうな扉を広く試す。,ランダムサーチ;グリッドサーチ;ハイパーパラメータ;探索効率;検証
G3000-R14-025,Rebuild_Set14,rebuild_50,term,ベイズ最適化,理解,用語説明,安定,高,評価に時間がかかるモデル設定で、過去の試行結果から次の有望候補を選ぶ発想はどれか。,画像の画素値を0か1に固定する方法,過去の試行結果をもとに、次に試す候補を効率よく選ぶ最適化方法,テキストを必ず単語単位に分ける方法,モデルの重みを人手で直接書き込む方法,B,ベイズ最適化は、評価に時間がかかる関数について、過去の結果から有望な次候補を選ぶ探索方法である。,トークン化の一例。,二値化処理の話。,通常の機械学習では重みを人手で直接設計しない。,正しい。,名前にベイズがあっても、単純なベイズ分類器とは別。,ミチが前回の失敗を見て、次に聞く問いを少し賢く選ぶ。,ベイズ最適化;ハイパーパラメータ最適化;探索;獲得関数;サロゲートモデル
G3000-R14-026,Rebuild_Set14,rebuild_50,case,パイプライン,判断,ケース判断,安定,中,学習時と推論時で、欠損値補完や標準化の手順がずれると性能が不安定になった。対策として最も適切なのはどれか。,推論時だけ目的変数を入力する,前処理とモデルを一連のパイプラインとして管理する,テストデータで標準化の平均を再計算して学習に戻す,モデルの名前を変える,B,前処理とモデルをパイプライン化すると、学習時と推論時の処理差異を減らしやすい。,評価情報の混入につながる。,目的変数を推論時に入力するのは不適切。,名前を変えても処理ずれは解消しない。,正しい。,モデル単体ではなく前処理込みで運用する点が問われる。,料理は材料だけでなく、切り方と火加減まで含めて同じにする。,パイプライン;前処理;推論;標準化;MLOps
